{
  "year": 2014,
  "totalMessages": 2964,
  "memberStats": {
    "Cosimo Nenciòni": {
      "messageCount": 656,
      "wordCount": 4628,
      "avgWordsPerMessage": 7.1,
      "longestMessage": "A tutti quelli che nei prossimi giorni avranno cene aziendali o cene tra amici, vorrei dare un consiglio e condividere un'esperienza riguardante il bere e guidare. Un paio di giorni fa ero fuori con degli amici e, dopo una buona cena e qualche birra, mi sono accorto che avevo forse bevuto troppo. Allora ho deciso di fare una cosa che non avevo fatto prima: lasciare l'auto, prendere l'autobus e tornare a casa... arrivare a casa sano e salvo è una piacevole sorpresa, soprattutto considerando che d"
    },
    "Alessio Valentini": {
      "messageCount": 720,
      "wordCount": 6781,
      "avgWordsPerMessage": 9.4,
      "longestMessage": "Due amiche dopo aver convinto i mariti, riescono ad uscire a cena da sole per svagarsi un po'. Fra una chiacchiera e l'altra e dopo due bottiglie di buon vino, lo champagne, i limoncelli e qualche amaro, si fa tardi e decidono di tornare a casa.Completamente ubriache escono dal ristorante e mentre camminano nella notte sentono l'impellente bisogno di fare la pipì, una\ndice: - Entriamo in quel cimitero, lì non ci vedrà nessuno. Così la prima si sfila le mutandine, fa una plin plin epocale e usa g"
    },
    "Alessio Macalùso": {
      "messageCount": 401,
      "wordCount": 2446,
      "avgWordsPerMessage": 6.1,
      "longestMessage": "Un accenno di canzone natalizia in un video o in un file audio cantata da voi da soli o con i vostri parenti/ fidanzate/ fratelli (insomma o da soli o con chi volete) per me sarebbe un bellissimo regalo e mi farebbe finalmente entrare nell'atmosfera natalizia! La mia canzone preferita è \"feliz navidad\" di jose feliciano e avrò un occhio di riguardo per chi opterà per questa"
    },
    "Fausto Petrini": {
      "messageCount": 372,
      "wordCount": 3635,
      "avgWordsPerMessage": 9.8,
      "longestMessage": "Lady Gaga : http://imgur.com/a/OxgBq\nTaylor Swift : http://imgur.com/a/VKeoI\nKaley Cuoco \"The big bang...\" : http://imgur.com/a/nPxXq\nJennetteMC \"Sam\"do icarly : http://imgur.com/a/IWy98\nMiley Cyrus : http://imgur.com/a/BxNW9\nJennifer Lopez : http://imgur.com/a/Jysz8\nNick Minaj : http://imgur.com/a/AB2hW\nSelena Gomez : http://imgur.com/a/Vxr5K\nParis Hilton : http://imgur.com/a/YhNOv\nRihanna : http://imgur.com/a/Uju3E\nJessica Alba : http://imgur.com/a/3oYNT\nKim Kardashian : http://imgur.com/a/cxk"
    },
    "Giacomo Dolfi": {
      "messageCount": 403,
      "wordCount": 2231,
      "avgWordsPerMessage": 5.5,
      "longestMessage": "Guarda \"Pharrell Williams - Happy (We Are From CAGLIARI)\" su YouTube - Pharrell Williams - Happy (We Are From CAGLIARI): http://youtu.be/uqaH76_oZ-Q\n22/03/14, 11:37 - Cocco: <Media omessi>\n24/03/14, 08:32 - Cocco: <Media omessi>"
    },
    "Adriano Sergio Lorenzo Facchini": {
      "messageCount": 320,
      "wordCount": 2097,
      "avgWordsPerMessage": 6.6,
      "longestMessage": "stanotte stavo sognando...ero in macchina fermo al semaforo, seduto nel sedile posteriore, e come guidatore c'era benito, il babbo di valentina. Ad un certo punto arrivano due zingare che si avvicinano all'auto e iniziano a girarci intorno. Chiudi le sicure! chiudi le sicure esclamo..ma niente. La prima zingara infila il braccio in auto e mi prende il portafoglio come se la scocca e i vetri non esistessero. ahhhhhhh! nel mentre aveva cominciato ad infilare le braccia anche la seconda zingara e a"
    }
  },
  "monthlyActivity": {
    "2014-01": 316,
    "2014-02": 214,
    "2014-03": 124,
    "2014-04": 45,
    "2014-05": 188,
    "2014-06": 156,
    "2014-07": 336,
    "2014-08": 184,
    "2014-09": 177,
    "2014-10": 333,
    "2014-11": 391,
    "2014-12": 408
  },
  "sampleMessages": [
    {
      "sender": "Alessio Valentini",
      "text": "propongo stasera, se davvero Fiamma ha indetto \"un aperitivo-cena dove ognuno porta un po' di cose\", di passare davanti all'ostricheria e portare alcuni big mac menus da asporto.",
      "date": "2014-01-02"
    },
    {
      "sender": "Alessio Macalùso",
      "text": "Azz... Esco da lavoro alle 16:30 e vado a giocare a pallone alle 18 ce la facciamo?",
      "date": "2014-01-04"
    },
    {
      "sender": "Fausto Petrini",
      "text": "Lady Gaga : http://imgur.com/a/OxgBq\nTaylor Swift : http://imgur.com/a/VKeoI\nKaley Cuoco \"The big bang...\" : http://imgur.com/a/nPxXq\nJennetteMC \"Sam\"do icarly : http://imgur.com/a/IWy98\nMiley Cyrus : http://imgur.com/a/BxNW9\nJennifer Lopez : http://imgur.com/a/Jysz8\nNick Minaj : http://imgur.com/a/",
      "date": "2014-01-11"
    },
    {
      "sender": "Alessio Valentini",
      "text": "riguardo alle fighe... avete cliccato su due o tre e poi vi sentite in grado di giudicare la migliore? ma fatemi ridere... esplorate... esplorate. il mondo è bello.",
      "date": "2014-01-11"
    },
    {
      "sender": "Alessio Macalùso",
      "text": "Ah già Elena non c'è in questo gruppo è inutile che la prenda per il culo",
      "date": "2014-01-11"
    },
    {
      "sender": "Adriano Sergio Lorenzo Facchini",
      "text": "e chi vuole intendere intenda\n01/11/14, 21:38 - +39 348 813 1011: <Media omessi>",
      "date": "2014-01-11"
    },
    {
      "sender": "Fausto Petrini",
      "text": "Jack dovresti aggiungere andre loretti a questa chat secondo me\n16/01/14, 17:25 - Cocco: <Media omessi>\n16/01/14, 21:06 - Cocco: <Media omessi>",
      "date": "2014-01-16"
    },
    {
      "sender": "Cosimo Nenciòni",
      "text": "Io gioco a tennis col giec alle 21 poi si va a mangiare una cosa da me. Verso le 22.30. Poi boh..chi vuole venire è welcame.",
      "date": "2014-01-17"
    },
    {
      "sender": "Alessio Macalùso",
      "text": "Va bene... Si beve fino alle 10 e poi si va da Cosimo",
      "date": "2014-01-17"
    },
    {
      "sender": "Cosimo Nenciòni",
      "text": "A noi le donne ci fanno cacare. Anzi.. Per l'addio al celibato del giec abbiamo deciso di fare incularella tra noi.",
      "date": "2014-01-18"
    },
    {
      "sender": "Giacomo Dolfi",
      "text": "Io sto a casa a guardare un film non porno con la Lucia malata",
      "date": "2014-01-18"
    },
    {
      "sender": "Fausto Petrini",
      "text": "Ma domani sera nel caso ci sarebbe nessuno? Forse devo tornare a si, anche se è  un gran sacrificio farlo...",
      "date": "2014-01-20"
    },
    {
      "sender": "Alessio Valentini",
      "text": "(in tempo reale)\n21/01/14, 22:57 - Alessio Valentini: <Media omessi>\n21/01/14, 23:24 - Cocco: <Media omessi>\n22/01/14, 00:54 - Alessio Valentini: <Media omessi>\n22/01/14, 12:42 - Alecs: <Media omessi>",
      "date": "2014-01-21"
    },
    {
      "sender": "Alessio Macalùso",
      "text": "Lo tengo per fausto quando ci invita a Firenze\n22/01/14, 12:47 - ‎Alessio Valentini ha cambiato l'immagine del gruppo.",
      "date": "2014-01-22"
    },
    {
      "sender": "Fausto Petrini",
      "text": "Allora, ho sentito cocco. Voleva sapere piu che altro chi siamo per capire se si fa da lui",
      "date": "2014-01-22"
    },
    {
      "sender": "Cosimo Nenciòni",
      "text": "Adriano e la vale mi sa che non vengono.  mi pare di capire che a Siena torna solo la macchina di giec che ha solo un posto. A sto punto si rimane a Firenze noi. Fate sapere a che ora ci si trova.",
      "date": "2014-01-25"
    },
    {
      "sender": "Cosimo Nenciòni",
      "text": "Io parto prima.. Tipo verso le 17.00 si voleva fare un giretto per negozi prima e fermatina da decatlon. Quindi ci si vede a Firenze direttamente. Se poi ale vuoi venire con noi prima facci sapere.",
      "date": "2014-01-25"
    },
    {
      "sender": "Alessio Valentini",
      "text": "elena turnaturi: Allora ho prenotato da Napoleone in piazza del Carmine alle 2030. È in posto carino non economicissimo ma fanno anche pizza! Ho prenotato per 14 se siamo di più Fatemi sapere",
      "date": "2014-01-25"
    },
    {
      "sender": "Giacomo Dolfi",
      "text": "Io e lucia la macchina si prende ma al ritorno si riporta Federico e Valeria che vanno nel tardo pomeriggio in autobus",
      "date": "2014-01-25"
    },
    {
      "sender": "Cosimo Nenciòni",
      "text": "Più giec Lucia fede e Valeria ma loro sono già a posto con la macchina.\n25/01/14, 12:40 - Alessio Valentini: <Media omessi>",
      "date": "2014-01-25"
    },
    {
      "sender": "Alessio Macalùso",
      "text": "Io verrei volentieri con voi ma poi per tornare stanotte o domattina c'è qualcuno?",
      "date": "2014-01-25"
    },
    {
      "sender": "Alessio Macalùso",
      "text": "Fermi tutti vedo ora che si parla di imbiancatura e non di sborra",
      "date": "2014-01-25"
    },
    {
      "sender": "Alessio Macalùso",
      "text": "Comunque non mi sembra corretto che io debba cambiare nome e Alessio no",
      "date": "2014-01-25"
    },
    {
      "sender": "Fausto Petrini",
      "text": "Cassa depositi e prestiti?\n28/01/14, 22:23 - Alecs: <Media omessi>\n28/01/14, 22:25 - Alessio Valentini: <Media omessi>",
      "date": "2014-01-28"
    },
    {
      "sender": "Giacomo Dolfi",
      "text": "Il bello\n28/01/14, 22:35 - Giec: <Media omessi>\n30/01/14, 08:13 - Fausto: <Media omessi>",
      "date": "2014-01-28"
    },
    {
      "sender": "Alessio Valentini",
      "text": "il video del biliardo è semplice. Ieri sbornia colossale a pranzo e nel pomeggio la goriziana è sclerata leggermente. Per farmi bere hanno messo i birilli tutto intorno alla bianca, ma io (a caso) sono riuscito a saltarli tutti.",
      "date": "2014-02-03"
    },
    {
      "sender": "Fausto Petrini",
      "text": "Per facilitare la vita a tutti (specie a cocco) posso dirvi che si puó fare da me, cena su in mansarda...",
      "date": "2014-02-04"
    },
    {
      "sender": "Giacomo Dolfi",
      "text": "Tra l'altro me l'ha sicuramente fatta uno spasimante...uno scatto rubato...\n02/06/14, 19:00 - Giec: <Media omessi>",
      "date": "2014-02-06"
    },
    {
      "sender": "Giacomo Dolfi",
      "text": "Questo bel pesciolino è stata la mia cena di sabato sera...roba da matti",
      "date": "2014-02-06"
    },
    {
      "sender": "Giacomo Dolfi",
      "text": "Se tutti lo mangiano quanto s'è mangiato noi ci si spanza in pochi...",
      "date": "2014-02-06"
    },
    {
      "sender": "Fausto Petrini",
      "text": "ONORE ALLE TETTE\nLa famiglia è seduta a cena. Il figlio chiede improvvisamente al padre:\n\"Papà, quanti tipi di tette ci sono?\"\nIl padre, sorpreso dalla domanda, risponde:\n\"Beh, figliolo, ci sono tre tipi di tette:\na vent’anni, le tette di una donna sono come meloni, tonde e sode.\nA trenta o quaranta",
      "date": "2014-02-10"
    },
    {
      "sender": "Giacomo Dolfi",
      "text": "Quando la Vale torna gli brucia il culo sicuro\n02/10/14, 20:21 - Alecs: <Media omessi>",
      "date": "2014-02-10"
    },
    {
      "sender": "Cosimo Nenciòni",
      "text": "Minchia!! Blow gli fa una maniglia a questo.\n15/02/14, 16:05 - Cocco: <Media omessi>\n15/02/14, 21:23 - Alecs: <Media omessi>",
      "date": "2014-02-14"
    },
    {
      "sender": "Fausto Petrini",
      "text": "Se no si puó fare anche da me a ville, ma immagino chr non tutti abbiano voglia di venire fino li. In ogni caso si puó andare nel salottino su...",
      "date": "2014-02-17"
    },
    {
      "sender": "Fausto Petrini",
      "text": "Allora lordi, che si fa domani? Cocco forse c'è ma forse no. Bisognerebbe organizzarsi da noi.. Anche adri ci sarebbe",
      "date": "2014-02-17"
    },
    {
      "sender": "Giacomo Dolfi",
      "text": "Purtroppo ho mangiato troppo e ciò mi ha reso silente dopo il primo",
      "date": "2014-02-19"
    },
    {
      "sender": "Alessio Valentini",
      "text": "come se io faccio: cos'è sta foto? e te invece di dirmi \"è marcello che chiede sigarette a tutta siena\" rispondi \"è lì davanti al porrione\"\n23/02/14, 13:50 - Alessio Valentini: <Media omessi>",
      "date": "2014-02-23"
    },
    {
      "sender": "Alessio Valentini",
      "text": "cmq io se era il teatro dei rozzi o meno... boh.. cmq c'era un karaoke fra vecchi ricchi. Noi siamo entrati, abbiamo scroccato da bere e poi fuori...",
      "date": "2014-02-23"
    },
    {
      "sender": "Alessio Valentini",
      "text": "ma scusami, ora metto una foto di piazza del campo e poi dico : \"cos'è?\", scommettendoci 50 euro e la risposta è \"piazza del campo\" ?",
      "date": "2014-02-23"
    },
    {
      "sender": "Alessio Macalùso",
      "text": "Come no: mandi la foto di una sala con scritto cosa è questo e la risposta è karaoke?",
      "date": "2014-02-23"
    },
    {
      "sender": "Fausto Petrini",
      "text": "La risposta non è completa, ma anche la domanda e quindi i termini della scommessa non erano chiari.",
      "date": "2014-02-23"
    },
    {
      "sender": "Alessio Macalùso",
      "text": "Hai messo una foto di una sala con dei tavoli e io ho indivinato",
      "date": "2014-02-23"
    },
    {
      "sender": "Alessio Valentini",
      "text": "Guarda \"Must See! 41 Metre Missile from Calhanoglu Rounds Off Fantastic Day for Hamburg\" su YouTube - https://www.youtube.com/watch?v=nK58AssP9tc&feature=youtube_gdata_player\n26/02/14, 19:11 - Alessio Valentini: <Media omessi>\n28/02/14, 11:55 - Alessio Valentini: <Media omessi>",
      "date": "2014-02-26"
    },
    {
      "sender": "Giacomo Dolfi",
      "text": "Comunque c'ha una signora fregna\n01/03/14, 14:28 - Alecs: <Media omessi>\n01/03/14, 22:07 - Alessio Valentini: <Media omessi>",
      "date": "2014-02-28"
    },
    {
      "sender": "Alessio Macalùso",
      "text": "Io mercoledì gioco a pallone fino alle 9 quindi meglio di no, comunque se tutti sono per mercoledì non c'è problema o arrivo più tardi o salto la partitella",
      "date": "2014-03-12"
    },
    {
      "sender": "Cosimo Nenciòni",
      "text": "Guarda \"The Pills - Il Piano Perfetto [Fenomenologia del …\" su YouTube - The Pills - Il Piano Perfetto [Fenomenologia del …: http://youtu.be/fS2VV9kMmHU",
      "date": "2014-03-12"
    },
    {
      "sender": "Cosimo Nenciòni",
      "text": "Ragazzi vi manno una cosa che secondo me è un manifesto degli ultimi 2 anni largo circa della nostra relazione amicale.",
      "date": "2014-03-12"
    },
    {
      "sender": "Fausto Petrini",
      "text": "Ma scusa sará il corriere di siena.. Il corriere della sera non ha mica la parte locale, o si?",
      "date": "2014-03-12"
    },
    {
      "sender": "Adriano Sergio Lorenzo Facchini",
      "text": "Perchè le ha mangiate prima lui..\n03/12/14, 14:38 - +39 348 813 1011: <Media omessi>",
      "date": "2014-03-12"
    },
    {
      "sender": "Adriano Sergio Lorenzo Facchini",
      "text": "waiting for cocco\n03/12/14, 19:00 - Cocco: <Media omessi>\n03/12/14, 19:00 - Cocco: <Media omessi>",
      "date": "2014-03-12"
    },
    {
      "sender": "Giacomo Dolfi",
      "text": "Guarda \"Pharrell Williams - Happy (We Are From CAGLIARI)\" su YouTube - Pharrell Williams - Happy (We Are From CAGLIARI): http://youtu.be/uqaH76_oZ-Q\n22/03/14, 11:37 - Cocco: <Media omessi>\n24/03/14, 08:32 - Cocco: <Media omessi>",
      "date": "2014-03-22"
    },
    {
      "sender": "Cosimo Nenciòni",
      "text": "Adriano vale e il non rispondente Macaluso andranno per aperitivo. Io vado a casa. Semmai potrei uscire dopo.. Semmai..",
      "date": "2014-03-28"
    },
    {
      "sender": "Fausto Petrini",
      "text": "Ma sicuro? Avevo capito che era uscito solo dal gruppk addio perchè temeva di essere sgamato da vale",
      "date": "2014-03-31"
    },
    {
      "sender": "Giacomo Dolfi",
      "text": "Mi ha appena confermato di aver disattivato whatsapp perche L'iPad non lo usa solo lui",
      "date": "2014-03-31"
    },
    {
      "sender": "Alessio Valentini",
      "text": "una mamma scrive su reddit preoccupata per il figlio che sta diventando ateo. Gli risponde un tizio con una risposta SPETTACOLARE. Non fa ridere, ma a me è piaciuto da morire.",
      "date": "2014-04-03"
    },
    {
      "sender": "Alessio Macalùso",
      "text": "Bello questo sport\n04/11/14, 19:51 - Alecs: <Media omessi>\n04/11/14, 19:51 - Alecs: <Media omessi>",
      "date": "2014-04-11"
    },
    {
      "sender": "Alessio Valentini",
      "text": "ci vuole du ore per linkare qua. e cmq Capa è l'unico insieme ad elio che mi fa trepidare d'attesa quando fa uscire cose nuove... tutti gli altri che mi garbano a tutto foco o sono del passato o so direttamente morti.",
      "date": "2014-05-03"
    },
    {
      "sender": "Fausto Petrini",
      "text": "Concordo. A me il primo singolo fa un effetto strano, di solito segno premonitore che poi mi piacerá parecchio. Trovo interessante la scelta di una base minimalista rispetto al passato.",
      "date": "2014-05-03"
    },
    {
      "sender": "Cosimo Nenciòni",
      "text": "Stamattina mps faceva + 3% ho detto al cliente di non comprare che tanto era un fuoco di paglia. Bene.. Ha chiuso +19%.. Domani verrò inculato col sale e pepe.",
      "date": "2014-05-03"
    },
    {
      "sender": "Fausto Petrini",
      "text": "Butta via questo libro di merda e procurati altro materiale di studio. Non esiste che un libro te la faccia così lunga senza ub metodo di semplificazione in simboli",
      "date": "2014-05-03"
    },
    {
      "sender": "Cosimo Nenciòni",
      "text": "Mah.. Forse no. Sennò ero ricco. Però manco dirgli quelli che gli ho detto. Tacci sua..\n05/03/14, 20:31 - Cocco: <Media omessi>",
      "date": "2014-05-03"
    },
    {
      "sender": "Cosimo Nenciòni",
      "text": "Ah no.. Era quello.. Mi sto a confonde.. Cmq secondo me il baronchelli lì è peggio..\n06/04/14, 04:26 - Alessio Valentini: <Media omessi>",
      "date": "2014-05-04"
    },
    {
      "sender": "Alessio Valentini",
      "text": "Guarda \"That's Gotta Suck: Man Gets Robbed At Gunpoint Fo…\" su YouTube - That's Gotta Suck: Man Gets Robbed At Gunpoint Fo…: http://youtu.be/i_KOBmtIUS0\n06/06/14, 20:42 - Cocco: <Media omessi>\n06/06/14, 22:42 - Cocco: <Media omessi>",
      "date": "2014-05-06"
    },
    {
      "sender": "Fausto Petrini",
      "text": "ecco il mio regalo do compleanno....\n05/06/14, 21:50 - Fausto: <Media omessi>\n05/06/14, 21:50 - Fausto: <Media omessi>",
      "date": "2014-05-06"
    },
    {
      "sender": "Adriano Sergio Lorenzo Facchini",
      "text": "stanotte stavo sognando...ero in macchina fermo al semaforo, seduto nel sedile posteriore, e come guidatore c'era benito, il babbo di valentina. Ad un certo punto arrivano due zingare che si avvicinano all'auto e iniziano a girarci intorno. Chiudi le sicure! chiudi le sicure esclamo..ma niente. La p",
      "date": "2014-05-12"
    },
    {
      "sender": "Adriano Sergio Lorenzo Facchini",
      "text": "salsiccie mozzarella di bufala pane di Altamura oricchiette con le cime di rape formaggio di capra un prosecco e poi un pò di bob",
      "date": "2014-05-12"
    },
    {
      "sender": "Fausto Petrini",
      "text": "Nel medioevo, quando un uomo moriva, per certificarne l'avvenuto decesso, veniva chiamato il medico condotto, il quale usava infliggere dolore al morto per verificare l'effettiva dipartita. Il metodo più usato era un potente morso alle dita dei piedi, quasi sempre l'alluce. Nel dialetto del popolino",
      "date": "2014-05-15"
    },
    {
      "sender": "Alessio Macalùso",
      "text": "Io invece vi propongo di venire a giocare con noi e poi intrattenerci in qualche modo",
      "date": "2014-05-19"
    },
    {
      "sender": "Cosimo Nenciòni",
      "text": "Guarda \"PESSOAS INCRIVEIS E PURA SORTE  parte n° 2 !!\" su YouTube - PESSOAS INCRIVEIS E PURA SORTE  parte n° 2 !!: http://youtu.be/Uc1GP_MUnMk",
      "date": "2014-05-23"
    },
    {
      "sender": "Alessio Valentini",
      "text": "una cosa tipo - ricordiamo che si deve ANDARE:\npunto uno: al mercato centrale\npunto due: a quel mercato fuori porta che nonostante varie vicissitudini ecc. ecc.",
      "date": "2014-06-03"
    },
    {
      "sender": "Fausto Petrini",
      "text": "É un libro di merda cocco. Non dipende dalla materia ma da come e chi te la spiega. Cambia libro",
      "date": "2014-06-03"
    },
    {
      "sender": "Fausto Petrini",
      "text": "Di certo le stesse cose le dgt per titolo e le trovi spiegste benissimo entro le prime due pagine google",
      "date": "2014-06-03"
    },
    {
      "sender": "Fausto Petrini",
      "text": "poi te dirai che siamo sempre i soliti bacchettoni, ma non è che gli altri non hanno bevuto, è che con te dopo in certo limite non si parlava neanche più, non ti fermi una volta partito...",
      "date": "2014-06-23"
    },
    {
      "sender": "Fausto Petrini",
      "text": "oh non è che ti sei regolato tanto eh, magari ha le sue ragioni... sei trampolato in terra non so quante volte....",
      "date": "2014-06-23"
    },
    {
      "sender": "Cosimo Nenciòni",
      "text": "Era abbastanza ingestibile.. Ma tant'è.. Lei ha fatto bene a dirtelo ora se fai il mongolo ti leva il saluto.",
      "date": "2014-06-23"
    },
    {
      "sender": "Alessio Macalùso",
      "text": "Ok\n27/06/14, 18:52 - Cocco: <Media omessi>\n28/06/14, 14:02 - Alecs: <Media omessi>",
      "date": "2014-06-24"
    },
    {
      "sender": "Alessio Valentini",
      "text": "ma invece che persone a caso sarebbe ganzo qualcuno che invece lo sappia e risponda tipo \"che hai detto?\" o con qualcosa di simpatico (invece della donnina che risponde a caso e dice nono, e riattacca)",
      "date": "2014-06-28"
    },
    {
      "sender": "Alessio Valentini",
      "text": "ragazzi, mi servite per un piacere. sabato prossimo per uno scherzo. in pratica durante la cena i. diretta gli sposi degono fare u a telefonata, e noi daremo dei numeri a caso.",
      "date": "2014-06-28"
    },
    {
      "sender": "Giacomo Dolfi",
      "text": "Sarebbe una mail letta con interesse\n04/07/14, 09:50 - Cocco: <Media omessi>\n04/07/14, 21:40 - Cocco: <Media omessi>",
      "date": "2014-06-29"
    },
    {
      "sender": "Giacomo Dolfi",
      "text": "La risata di questo soggetto è fantastica\n08/02/14, 02:09 - Alessio Valentini: <Media omessi>\n08/02/14, 02:10 - Alessio Valentini: <Media omessi>",
      "date": "2014-07-02"
    },
    {
      "sender": "Cosimo Nenciòni",
      "text": "Fausto è sulla sita degli stolti.. Si fa il tour del Chianti prima di arrivare a Siena. Io sita vip rapida.",
      "date": "2014-07-03"
    },
    {
      "sender": "Fausto Petrini",
      "text": "Cocco ci si aspetta all'arrivo sita cosí mi dai uno strappo? Se no sono un po neo casini coi tempi",
      "date": "2014-07-03"
    },
    {
      "sender": "Cosimo Nenciòni",
      "text": "Con i culi e le cosce che girano per Firenze in questi giorni sono arrivato alla conclusione che dovremmo brevettare lo specchietto retrovisore per pedoni. Grande svolta sarebbe.",
      "date": "2014-07-07"
    },
    {
      "sender": "Giacomo Dolfi",
      "text": "Anche io alle 00.36 ero in casa fermo a letto che leggevo ma non ho sentito niente",
      "date": "2014-07-07"
    },
    {
      "sender": "Fausto Petrini",
      "text": "Sentite, appena sapete che volete fare fatemelo sapere, se venite a firenze o si fa qualcosa a siena per me fa un po la differenza. Io di base sono a casa solo, se non si fa niente mi organizzo per altro\n07/11/14, 10:59 - Alessio Valentini: <Media omessi>",
      "date": "2014-07-11"
    },
    {
      "sender": "Cosimo Nenciòni",
      "text": "È che io ho finito ora di stuccare imbiancare e liberare camera da scatoloni e mi devo lavare non c'ho voglia di uscire a fare la spesa. Magari una pasta o si prende qualcosa fuori non c'è problema",
      "date": "2014-07-11"
    },
    {
      "sender": "Alessio Valentini",
      "text": "in questa chat non si capisce niente... ma in questo momento ho un'altra chat dove Samet Sensei mette il nonsense in tutta un'altra dimensione...\n07/11/14, 10:46 - Alessio Valentini: <Media omessi>",
      "date": "2014-07-11"
    },
    {
      "sender": "Fausto Petrini",
      "text": "Oh ghiozzi, Io stasera ci posso essere, ele non c'è, qualcuno ha parlato di sagra el porcino. Se mi fate sapere mi organizzo, se no sto a firenze",
      "date": "2014-07-11"
    },
    {
      "sender": "Alessio Macalùso",
      "text": "Riapro ora whatsapp e vedo che quel superduro di Adriano in tutta la mattina ancora non vi ha detto una cosa fondamentale",
      "date": "2014-07-11"
    },
    {
      "sender": "Adriano Sergio Lorenzo Facchini",
      "text": "si parlava con el rinko di un'ipotetica mission to florence con partenza ore 20:30 dopo il tennis con giec.",
      "date": "2014-07-11"
    },
    {
      "sender": "Adriano Sergio Lorenzo Facchini",
      "text": "optimus\n07/11/14, 22:18 - Cocco: <Media omessi>\n07/11/14, 22:40 - Cocco: <Media omessi>\n08/11/14, 11:12 - Cocco: <Media omessi>",
      "date": "2014-07-11"
    },
    {
      "sender": "Adriano Sergio Lorenzo Facchini",
      "text": "ma se alessio non mi dice quel che vuole fare come si fa ad organizzarsi?",
      "date": "2014-07-11"
    },
    {
      "sender": "Adriano Sergio Lorenzo Facchini",
      "text": "Effettivamente non ho pace..\nmi sfogherò sulla terra rossa..\nche diventerà ancora più rossa.........",
      "date": "2014-07-11"
    },
    {
      "sender": "Alessio Valentini",
      "text": "ao... buonG ragazzi. io mi sa che dormo ancora...\n07/12/14, 13:25 - Cocco: <Media omessi>\n07/12/14, 13:25 - Cocco: <Media omessi>\n07/12/14, 13:32 - Alessio Valentini: <Media omessi>",
      "date": "2014-07-12"
    },
    {
      "sender": "Adriano Sergio Lorenzo Facchini",
      "text": "ora mando un mex a renata e gli dico che con noi non la prende mao bella..",
      "date": "2014-07-12"
    },
    {
      "sender": "Giacomo Dolfi",
      "text": "A me m'aspetta un pomeriggio all'ikea preoccupante...dopo mi sentirò con fausto, ma non s'è fissato niente",
      "date": "2014-07-12"
    },
    {
      "sender": "Giacomo Dolfi",
      "text": "Guarda bene dove è...un punto in cui fare un incidente del genere è da veri professionisti",
      "date": "2014-07-21"
    },
    {
      "sender": "Cosimo Nenciòni",
      "text": "Qualcuno ha voglia di venire a montare un mobiletto IKEA da me stasera? Offro una birretta e un bicchiere di spuma.",
      "date": "2014-07-22"
    },
    {
      "sender": "Alessio Valentini",
      "text": "Scusate per ieri sono morto dopo la partita. E, dovevo stare un po' con Chiara che poi vado in Puglia e non lancaco per 15 gg",
      "date": "2014-07-23"
    },
    {
      "sender": "Alessio Valentini",
      "text": "Allora. Marcella farà la pizza un giorno fra Marte e Lune. Lei preferisce Martedì. Non solo. Lei vuole Cocco a cena. Siete tutti invitati SE cocco può venire.",
      "date": "2014-08-11"
    },
    {
      "sender": "Cosimo Nenciòni",
      "text": "A tutti quelli che nei prossimi giorni avranno cene aziendali o cene tra amici, vorrei dare un consiglio e condividere un'esperienza riguardante il bere e guidare. Un paio di giorni fa ero fuori con degli amici e, dopo una buona cena e qualche birra, mi sono accorto che avevo forse bevuto troppo. Al",
      "date": "2014-08-12"
    },
    {
      "sender": "Fausto Petrini",
      "text": "Old cicken makes good brooth\n08/12/14, 16:22 - Cocco: <Media omessi>\n09/12/14, 16:00 - +39 348 813 1011: <Media omessi>",
      "date": "2014-08-12"
    },
    {
      "sender": "Alessio Valentini",
      "text": "il rhum sparletta eh?\n14/08/14, 12:13 - Giec: <Media omessi>\n14/08/14, 12:13 - Giec: <Media omessi>\n14/08/14, 12:14 - Giec: <Media omessi>\n14/08/14, 12:14 - Giec: <Media omessi>\n14/08/14, 12:14 - Giec: <Media omessi>",
      "date": "2014-08-14"
    },
    {
      "sender": "Fausto Petrini",
      "text": "soprattutto per la bibita che non bevrô mai\n14/08/14, 12:19 - Giec: <Media omessi>\n14/08/14, 12:19 - Giec: <Media omessi>",
      "date": "2014-08-14"
    },
    {
      "sender": "Alessio Valentini",
      "text": "il ristorante da Tommaso è come una droga. Sono stato 6 mesi senza andarci e... potevo farne a meno... ora ho una voglia di ritornarci che mi MANGIA. Carne cotta al carbone, pici all'aglione (pici rossi, direttamente con l'aglione nella pasta), Polpo con i porcini crudi... volevo prendere quei 35 eu",
      "date": "2014-08-15"
    },
    {
      "sender": "Alessio Valentini",
      "text": "praticamente lui prepara una salsa di pomodoro e aglio senza farla soffriggere, scioglie l'aglio nel pomodoro in 2 ore di cottura. poi prende la farina e ci fa i pici. poi fa il sughetto, usa il formaggio sciolto in acqua fresca, semi di papavero e via... facile... un cazzo...",
      "date": "2014-08-15"
    },
    {
      "sender": "Alessio Valentini",
      "text": "ieri mi è successa una cosa ganza... decidiamo all'ultimo di andare a Vagliagli, e c'era Cisco a suonare, col nuovo gruppo. Fanno canzoni degli ultimi album e, non so perché, la gente vocifera che NON fa mai canzoni dei Modena city ramblers. Quindi io sono fra le prime file a guardare, così, con Chi",
      "date": "2014-08-24"
    },
    {
      "sender": "Fausto Petrini",
      "text": "no scusa, ha appena detto che è in gruppo di sfigati, non lo riaggiungere finchè non te lo chiede in ginoccjio",
      "date": "2014-08-26"
    },
    {
      "sender": "Giacomo Dolfi",
      "text": "Io in realtà sarei nell'istricione ma mi do morto all'ultimo pe festeggia il tu compleanno",
      "date": "2014-08-26"
    },
    {
      "sender": "Cosimo Nenciòni",
      "text": "Appena recuperato il cel. Ale a quanto pare siamo io te Ciacci e rena. Gli altri sono dei soloni. Se ti impiccia venire a Siena per cenare e scappare via subito si postpone alla prox settimana. Mi sei sembrato alle strette coi tempi.",
      "date": "2014-08-28"
    },
    {
      "sender": "Cosimo Nenciòni",
      "text": "Stasera chi c'è per un cenino o aperitivo?. Co Alessio si pensava al sushi alla pam tanto per fare qualcosa di new. GIEC e signora? Alecs te lavori?",
      "date": "2014-08-28"
    },
    {
      "sender": "Alessio Valentini",
      "text": "siamo a pranzo a castell in villa. Prima di ritrovarci alla coop (a castelnuovo) il ciammino domanda per WhatsApp se la coop era quella delle grondaie. iniziamo a prenderlo per il culo... tipo youness dice: sisi, andiamo alla pam, e uga, si va ai gigli a firenze, io si va al mugello... hahah grosse ",
      "date": "2014-09-11"
    },
    {
      "sender": "Alessio Valentini",
      "text": "m'ha fatto ridere...\n15/09/14, 13:52 - Cocco: <Media omessi>\n16/09/14, 16:02 - Cocco: <Media omessi>\n16/09/14, 22:58 - Alecs: <Media omessi>\n17/09/14, 17:27 - Fausto: <Media omessi>",
      "date": "2014-09-15"
    },
    {
      "sender": "Giacomo Dolfi",
      "text": "Dicci che portare per il big event\n18/09/14, 12:17 - Cocco: <Media omessi>",
      "date": "2014-09-18"
    },
    {
      "sender": "Alessio Valentini",
      "text": "ieri ragazzi i cinesi che avevo in salotto (6 in tutto), sono venuti a bussarmi alla porta... stavano giocando a obbligo e verità e la ragazza doveva dirmi \" Alessio, te quiero \". Non ho aperto. Sono uscito diversi minuti dopo e un ragazzo stava arrampicandosi sulle ginocchia piegate di due ragazze,",
      "date": "2014-09-21"
    },
    {
      "sender": "Alessio Valentini",
      "text": "Sono andato in bagno, ho pulito la tazza e mi sono messo a cacare sperando di fare un puzzo nauseabondo dopo le scorpacciate di vienna. Delusione totale. Quasi ho cacato fiori.",
      "date": "2014-09-21"
    },
    {
      "sender": "Alessio Valentini",
      "text": "ragazzi... io lo so che sono nuovo a questi tipi di esclamazioni ma... qua c'è una quantità di fica subnormale... io non mi ricordavo niente del genere... madonna santa...",
      "date": "2014-09-21"
    },
    {
      "sender": "Fausto Petrini",
      "text": "ma ci so si... pero faccio presto, devo torna a fi. che porto? spero vogliamo impegnarvi nell'organizzazione... giornali di donne nude? pipette? pippette??",
      "date": "2014-09-23"
    },
    {
      "sender": "Alessio Macalùso",
      "text": "Qualcuno ne vuole un pezzo da portare a casa che ne ho tanta?",
      "date": "2014-09-23"
    },
    {
      "sender": "Cosimo Nenciòni",
      "text": "Domani mattina devo forse andare a pulire gli ulivi a certaldo. Sarei maggiormente invogliato se per pranzo venisse qualcuno a pranzo. Si compra un paio di fiorentine e si buttano sul camino. Interessa o no?",
      "date": "2014-09-26"
    },
    {
      "sender": "Cosimo Nenciòni",
      "text": "Vabbe si vede stasera.. Mac ci sentiamo per cena. Giec mi sa che dopo cena non è easy vedersi fausto corca che ci si vede alessio bella PE te ci si vede a Madrid.",
      "date": "2014-09-26"
    },
    {
      "sender": "Alessio Valentini",
      "text": "ma voi non siete dei veri hardcore... eravamo qua a casa di Chiara a fi ed abbiamo ordinato cinese da asporto\n11/03/14, 17:19 - Cocco: <Media omessi>",
      "date": "2014-10-03"
    },
    {
      "sender": "Cosimo Nenciòni",
      "text": "Zitto zitto.. Ora mi aspetta un viaggio in sita da paura.. Coi tutto bene? Pure Renata ko. C'ha pure la febbra quella..",
      "date": "2014-10-03"
    },
    {
      "sender": "Giacomo Dolfi",
      "text": "Io anche se ieri sera sono andato a mangiare una pizza oggi ho comunque cacato sciolto e stasera sto a casa",
      "date": "2014-10-03"
    },
    {
      "sender": "Cosimo Nenciòni",
      "text": "Io so a Siena ma so uno straccio. Riso bianco e imodium. Mi muro per i prox 7/8 giorni almeno.",
      "date": "2014-10-03"
    },
    {
      "sender": "Alessio Valentini",
      "text": "se non puoi fare in un altro modo... boh... prova a chiamarci per sentire a che punto siamo... tanto la mi mamma fa sempre molta pizza...",
      "date": "2014-10-11"
    },
    {
      "sender": "Fausto Petrini",
      "text": "Io potrei anche venire, con un po di disagi, ma posso dirtelo domattina? Devo finire una cosa, scusate",
      "date": "2014-10-11"
    },
    {
      "sender": "Cosimo Nenciòni",
      "text": "Io sono d'accordo sul fatto che fa ridere lo stesso. Come la cheerleader che caga a spruzzo sulle sue colleghe mentre viene lanciata.",
      "date": "2014-10-16"
    },
    {
      "sender": "Alessio Valentini",
      "text": "in spagna mi hanno dato una medicina, ma l'ho presa 2 volte e m'ha iniziato a dare giramenti di testa. Quindi siccome gli acidi sono belli, ma quando non c'hai da fare un cazzo, allora volevo sapere che cazzo era.",
      "date": "2014-10-17"
    },
    {
      "sender": "Alessio Valentini",
      "text": "no, niente.. al matrimonio del Tofani (6 settembre) ho fatto un salto mortale (credevo d'essere un acrobata) e sono caduto di schiena. mi fa ancora male.",
      "date": "2014-10-17"
    },
    {
      "sender": "Fausto Petrini",
      "text": "Ieri sera nel quartiere dei locali grande bolgia, un tipo accanto a me si mette a pisciare tranwuillamente a una vetrina, dopo un po mentre camminiamo noto un ripo guardingo su dei gradini che rulla. Penso \"ma si fsnno le canne così a giro in noshalanse?\" al che lui si infila l'oggetto rollato nel n",
      "date": "2014-10-18"
    },
    {
      "sender": "Adriano Sergio Lorenzo Facchini",
      "text": "il mio silenzio era dovuto alla semplice lontananza dallo smart phone {[( Samsung) economico] alla fine uguale se non meglio dell'iphone6}",
      "date": "2014-10-20"
    },
    {
      "sender": "Fausto Petrini",
      "text": "Bene, mi correggo. Domani pomeriggio vengo a siena di sicuro. Se qualcuno c'è mi faccia sapere. Per ven io non so, ma se ci sono sono con ele credo",
      "date": "2014-10-22"
    },
    {
      "sender": "Fausto Petrini",
      "text": "Mongoli io torno domani sera ( merc. Sera ) a siena e sono da solo. Chi c'è? Si fa nulla? Si fuma?",
      "date": "2014-10-22"
    },
    {
      "sender": "Alessio Valentini",
      "text": "oootttimo... faremmo qualcosa... vedremmo\n23/10/14, 23:41 - Fausto: <Media omessi>\n23/10/14, 23:41 - Fausto: <Media omessi>\n26/10/14, 14:35 - Fausto: <Media omessi>\n26/10/14, 21:50 - Alecs: <Media omessi>",
      "date": "2014-10-23"
    },
    {
      "sender": "Cosimo Nenciòni",
      "text": "IL FARMACISTA\nUn giovane ragazzo entra in una farmacia e dice al farmacista:\n- Buongiorno, mi dia un preservativo. La mia ragazza mi ha invitato a cena stasera e credo che si aspetti qualcosa da me\nIl farmacista gli dà il preservativo e quando sta per uscire, il ragazzo si gira e dice:\n- Me ne dia u",
      "date": "2014-10-27"
    },
    {
      "sender": "Giacomo Dolfi",
      "text": "Fausto invece di fatti le seghe pensa\n11/07/14, 17:34 - Alessio Valentini: <Media omessi>",
      "date": "2014-11-07"
    },
    {
      "sender": "Fausto Petrini",
      "text": "questo audio fatto da simone badini della chiocciola (per chi lo conosce) mi ha fatto piegare...\n15/09/14, 11:16 - Cocco: <Media omessi>",
      "date": "2014-11-09"
    },
    {
      "sender": "Cosimo Nenciòni",
      "text": "Fausto a che ore stasera? E dove? Ce la fai a venire tu da me? Se vengo io è finita perdiamo 1 ora",
      "date": "2014-11-12"
    },
    {
      "sender": "Giacomo Dolfi",
      "text": "Noi colle\n11/12/14, 20:55 - Cocco: <Media omessi>\n11/12/14, 20:56 - Cocco: <Media omessi>\n11/12/14, 20:58 - Alessio Valentini: <Media omessi>",
      "date": "2014-11-12"
    },
    {
      "sender": "Giacomo Dolfi",
      "text": "posizione: https://maps.google.com/?q=43.4222382,11.1344124\n11/12/14, 20:59 - Alessio Valentini: <Media omessi>\n11/12/14, 23:10 - Giec: <Media omessi>",
      "date": "2014-11-12"
    },
    {
      "sender": "Alessio Valentini",
      "text": "Due amiche dopo aver convinto i mariti, riescono ad uscire a cena da sole per svagarsi un po'. Fra una chiacchiera e l'altra e dopo due bottiglie di buon vino, lo champagne, i limoncelli e qualche amaro, si fa tardi e decidono di tornare a casa.Completamente ubriache escono dal ristorante e mentre c",
      "date": "2014-11-14"
    },
    {
      "sender": "Giacomo Dolfi",
      "text": "Adri io vengo a testimoniare per te. Lo so che Fausto ci sente sempre...\n16/11/14, 22:29 - Alessio Valentini: <Media omessi>",
      "date": "2014-11-16"
    },
    {
      "sender": "Adriano Sergio Lorenzo Facchini",
      "text": "se me ne prendi la più piccola ti ridò i soldi...con gli interessi..però si fa un contratto prima. .",
      "date": "2014-11-16"
    },
    {
      "sender": "Alessio Valentini",
      "text": "Guarda \"Casa Elio e le Storie Tese: Faso vi insegna come …\" su YouTube - Casa Elio e le Storie Tese: Faso vi insegna come …: http://youtu.be/1LU72BASQBo",
      "date": "2014-11-19"
    },
    {
      "sender": "Giacomo Dolfi",
      "text": "Io passerò la mia serata al capezzale di lucia che ha la febbre a 39",
      "date": "2014-11-19"
    },
    {
      "sender": "Adriano Sergio Lorenzo Facchini",
      "text": "Una donna sta passeggiando in un bosco alla ricerca di funghi, quando\ns’ imbatte in un’antica lampada ad olio; inizia subito a strofinarla e\nappare il Genio: \"Posso avere i miei tre desideri?\"\n\"No. A causa dei cattivi tempi, della recessione, della\nglobalizzazione, dell’inflazione, degli scioperi e ",
      "date": "2014-11-20"
    },
    {
      "sender": "Cosimo Nenciòni",
      "text": "Cmq Faso al 4.24 mi fa schiantare da ridere... Non lo posso vedere..\n21/11/14, 11:36 - Alessio Valentini: <Media omessi>",
      "date": "2014-11-20"
    },
    {
      "sender": "Fausto Petrini",
      "text": "giochiamo, se sbagli risposta dovrai mettere la foto della scimmia nel tuo profilo per 24 ore.\nEcco il calcolo:\n1  3  5\n2  4  ?\nCosa c'è al posto del punto di domanda? Ti dico già che la soluzione non è 6 ??? Mandami la soluzione.",
      "date": "2014-11-21"
    },
    {
      "sender": "Adriano Sergio Lorenzo Facchini",
      "text": "la vita è un bonus e bisogna lavorare il meno possibile..\n24/11/14, 08:48 - Fausto: <Media omessi>",
      "date": "2014-11-22"
    },
    {
      "sender": "Adriano Sergio Lorenzo Facchini",
      "text": "cmq ho guardato i biglietti aerei per un ipotetico viaggio tipo a berlino tipo in un mese come marzo..",
      "date": "2014-11-24"
    },
    {
      "sender": "Cosimo Nenciòni",
      "text": "Devo vedere ho un sacco di seghe nei prox giorni. Cene di lavoro eventi del cazzo coi clienti ecc. Ora appena posso vedo se ci sono o no mercoledì.",
      "date": "2014-11-26"
    },
    {
      "sender": "Alessio Macalùso",
      "text": "Attenzione attenzione! Hanno riavvistato il maniaco di prima\n26/11/14, 20:31 - Alecs: <Media omessi>\n26/11/14, 20:32 - Alecs: <Media omessi>",
      "date": "2014-11-26"
    },
    {
      "sender": "Adriano Sergio Lorenzo Facchini",
      "text": "pensa a quando non potrai piu farle..\n28/11/14, 10:31 - Alessio Valentini: <Media omessi>\n28/11/14, 14:34 - Giec: <Media omessi>",
      "date": "2014-11-28"
    },
    {
      "sender": "Adriano Sergio Lorenzo Facchini",
      "text": "si addrizza quando si deve addrizzare, e per un fake non mi si addrizza",
      "date": "2014-11-28"
    },
    {
      "sender": "Cosimo Nenciòni",
      "text": "Ok. Passo a prenderti alle 19.00. Devo fare un salto alla coop poi si va in città a fare aperitivo?",
      "date": "2014-12-08"
    },
    {
      "sender": "Cosimo Nenciòni",
      "text": "Fausto dorme e Alessio idem.. Domani io mi sa che ti piscio.. Mi fa cacare sia la bb che festambiente..",
      "date": "2014-12-08"
    },
    {
      "sender": "Alessio Macalùso",
      "text": "A me mi garba abbestia sia festambiente che bandabardò ma non vengo perché so schiavo del lavoro",
      "date": "2014-12-08"
    },
    {
      "sender": "Alessio Macalùso",
      "text": "Sei sicuro che vuoi andare con una macchina? Guarda che devo tornare presto",
      "date": "2014-12-08"
    },
    {
      "sender": "Adriano Sergio Lorenzo Facchini",
      "text": "gentaglia..\n12/10/14, 16:02 - Cocco: <Media omessi>\n13/10/14, 15:05 - Cocco: <Media omessi>\n16/10/14, 08:57 - Fausto: <Media omessi>",
      "date": "2014-12-10"
    },
    {
      "sender": "Alessio Valentini",
      "text": "Telefonata di Marcella. Dice:\n- vuole sapere se vi è piaciuta\n- quella pianta non sa che farci, avete sicuramente speso troppo e forse ora la mette al posto dell'albero di Natale (dice ringraziali comunque, ma meglio niente o qualcosa di più piccino la prossima volta)\n- non dovevano far pagare la pi",
      "date": "2014-12-11"
    },
    {
      "sender": "Alessio Valentini",
      "text": "io non ho dormito una sega... voi tutto bene? ao, mi ha fatto un effetto strano. Firenze piena di zanzare. Sete mortale. 10 volte a pisciare...",
      "date": "2014-12-11"
    },
    {
      "sender": "Cosimo Nenciòni",
      "text": "Ragazzi.. Cos'era quel coso rosso che stava tra la roba di Tiziano? Quello che s'è detto che era tipico degli anni 80",
      "date": "2014-12-11"
    },
    {
      "sender": "Giacomo Dolfi",
      "text": "Adri ti ricordo cosa mi hai detto quando ti ho detto che Alessio m secondo me non doveva mettere i soldi",
      "date": "2014-12-11"
    },
    {
      "sender": "Adriano Sergio Lorenzo Facchini",
      "text": "eh si, ho detto una cosa che vi ha convinto in uno schiocco di dita",
      "date": "2014-12-11"
    },
    {
      "sender": "Adriano Sergio Lorenzo Facchini",
      "text": "chi si ricorda qual'era quel film che inneggiavano fuoco e fiamme!! fuoco e fiamme!!!",
      "date": "2014-12-11"
    },
    {
      "sender": "Alessio Macalùso",
      "text": "Oggi ragazzi dovete mandare una foto con gli occhiali da vista più simili possibile ai miei\n12/12/14, 13:33 - Alessio Valentini: <Media omessi>",
      "date": "2014-12-12"
    },
    {
      "sender": "Alessio Macalùso",
      "text": "È solo una prova per vedere quanto siete fedeli a me che sono re\n12/12/14, 19:35 - +39 348 813 1011: <Media omessi>",
      "date": "2014-12-12"
    },
    {
      "sender": "Alessio Macalùso",
      "text": "Meglio di Adriano non è una giustificazione\n12/12/14, 22:57 - Cocco: <Media omessi>\n12/12/14, 23:56 - Fausto: <Media omessi>",
      "date": "2014-12-12"
    },
    {
      "sender": "Alessio Macalùso",
      "text": "Se siete bravi verrete ricompensati con un videomessaggio di ringraziamento\n12/12/14, 22:50 - Cocco: <Media omessi>",
      "date": "2014-12-12"
    },
    {
      "sender": "Fausto Petrini",
      "text": "QUESTO É IL SIMBOLO DEL GRANDE SHOGUN MITSUKYNIMITOOOOOOOOO!!! INCHINATEVI ALLA SUA POTENZAAAAAA.....\nacaghenó conomatee\nCunumata achemiunumataaaa\nDarenagu o donoaghe...\nChiorioda de ichunumadaaa\nSo denuamacateee\nIchi ebi unumataaaa\nO ede mashidaooo\nodoe saundeeee\nCHAMBARAAAAAA\nCHAMBARAAAA\nebi usa o",
      "date": "2014-12-13"
    },
    {
      "sender": "Fausto Petrini",
      "text": "Se la ritrivate sono convinto che ne ho azzeccato almeno il 60%\n13/12/14, 01:33 - Fausto: <Media omessi>",
      "date": "2014-12-13"
    },
    {
      "sender": "Alessio Macalùso",
      "text": "Sarebbe bello creare una catena di Sant'Antonio da mandare su whatsapp\n13/12/14, 10:59 - Alecs: <Media omessi>",
      "date": "2014-12-13"
    },
    {
      "sender": "Adriano Sergio Lorenzo Facchini",
      "text": "mio signore perdoni quel povero anziano smemorato. .\n13/12/14, 12:56 - Fausto: <Media omessi>",
      "date": "2014-12-13"
    },
    {
      "sender": "Alessio Macalùso",
      "text": "Stavo pensando che mi farebbe molto piacere ricevere in questo gruppo un videomessaggio di saluti da una persona a me sconosciuta. Allietatemi mandando un messaggio di lode rivolto a me entro martedì sera alle 22:00",
      "date": "2014-12-14"
    },
    {
      "sender": "Cosimo Nenciòni",
      "text": "Guarda \"The Pills - La Puntata di Natale (2° Stagione)\" su YouTube - The Pills - La Puntata di Natale (2° Stagione): http://youtu.be/fBRkrJ7QM5Q\n14/12/14, 20:04 - Cocco: <Media omessi>",
      "date": "2014-12-14"
    },
    {
      "sender": "Alessio Macalùso",
      "text": "Avrei dovuto mandarvi un messaggio di ringraziamento ma solo 3 di voi hanno saputo soddisfare le mie aspettative",
      "date": "2014-12-14"
    },
    {
      "sender": "Fausto Petrini",
      "text": "Leader: sono stato tutto il die in casa, doveva venire l'idraulico al quale avrei sottoposto il tuo desiderio a costo di pagare, purtroppo non venne, ed io in tutto il giorno non vidi nessuno a te onconsueto. Dammi un altra possibilità,",
      "date": "2014-12-16"
    },
    {
      "sender": "Alessio Valentini",
      "text": "il mio nuovo sfondo del desktop qua in lab...\n18/12/14, 14:09 - Alessio Valentini: <Media omessi>\n18/12/14, 23:24 - Cocco: <Media omessi>\n19/12/14, 09:53 - Alessio Valentini: <Media omessi>",
      "date": "2014-12-18"
    },
    {
      "sender": "Adriano Sergio Lorenzo Facchini",
      "text": "per allietarti ti canterò un piccolissimo pezzetto di una famosissima canzone..\n19/12/14, 17:08 - +39 348 813 1011: <Media omessi>\n19/12/14, 18:01 - Fausto: <Media omessi>\n19/12/14, 18:03 - Fausto: <Media omessi>",
      "date": "2014-12-19"
    },
    {
      "sender": "Cosimo Nenciòni",
      "text": "Io non me ne so manco accorto.. E sto al 2 piano di un palazzo che casca a pezzi. Mi ci gira quasi il cazzo.\n19/12/14, 18:06 - Fausto: <Media omessi>",
      "date": "2014-12-19"
    },
    {
      "sender": "Cosimo Nenciòni",
      "text": "Il TV non me li legge. E manco le app che ho sul mac. Come faccio? Convertrli in avi mi fa perdere in qualità mi sa vero??",
      "date": "2014-12-19"
    },
    {
      "sender": "Alessio Macalùso",
      "text": "L'estensione mkv indica il contenitore e non la codifica, quindi prova prima con altri film sul televisore",
      "date": "2014-12-19"
    },
    {
      "sender": "Alessio Macalùso",
      "text": "Per convertire ci sono tanti programmi basta cercare ma fai prima a riscaricarle il film",
      "date": "2014-12-19"
    },
    {
      "sender": "Giacomo Dolfi",
      "text": "Te pensa ad onorare le richieste del leader che finora non hai fatto niente",
      "date": "2014-12-20"
    },
    {
      "sender": "Alessio Macalùso",
      "text": "Classifica generale dei miei sudditi prediletti fatta sulla base di come avete accolto le mie richieste:\nSuddito Valentini pt. 10\nSuddito Dolfi pt. 7\nSuddito Nencioni pt. 7\nSuddito Petrini pt. 4\nSottoposto Facchini pt. 2",
      "date": "2014-12-21"
    },
    {
      "sender": "Giacomo Dolfi",
      "text": "È scontato che le decisioni del leader sono quelle migliori, ma i due punti ad Adriano mi sembrano regalati...",
      "date": "2014-12-21"
    },
    {
      "sender": "Giacomo Dolfi",
      "text": "Adrenalina pura\n24/12/14, 01:48 - Alessio Valentini: <Media omessi>\n24/12/14, 01:54 - Alecs: <Media omessi>",
      "date": "2014-12-23"
    },
    {
      "sender": "Alessio Macalùso",
      "text": "Un accenno di canzone natalizia in un video o in un file audio cantata da voi da soli o con i vostri parenti/ fidanzate/ fratelli (insomma o da soli o con chi volete) per me sarebbe un bellissimo regalo e mi farebbe finalmente entrare nell'atmosfera natalizia! La mia canzone preferita è \"feliz navid",
      "date": "2014-12-24"
    },
    {
      "sender": "Cosimo Nenciòni",
      "text": "Tanti auguri Adriano. Pure alla vale.\n24/12/14, 20:32 - Cocco: <Media omessi>\n24/12/14, 21:27 - +39 348 813 1011: <Media omessi>",
      "date": "2014-12-24"
    },
    {
      "sender": "Alessio Macalùso",
      "text": "Lasciate che i pargoli vengano a me\n25/12/14, 01:27 - Alessio Valentini: <Media omessi>",
      "date": "2014-12-24"
    },
    {
      "sender": "Cosimo Nenciòni",
      "text": "Merde.. Organizzate alle mie spalle.. Il giorno di natale.. Menomale che Alessio è tordo e ci scombina i vostri piani.",
      "date": "2014-12-25"
    },
    {
      "sender": "Alessio Macalùso",
      "text": "Una folla di ubriachi che fa quello che gli dici: complimenti\n25/12/14, 02:55 - Fausto: <Media omessi>",
      "date": "2014-12-25"
    },
    {
      "sender": "Alessio Macalùso",
      "text": "Classifica generale dei miei sudditi prediletti fatta sulla base di come avete accolto le mie richieste:\nSuddito Valentini pt. 15\nSuddito Nencioni pt. 9\nSuddito Dolfi pt. 8\nSuddito Petrini pt. 8\nSuddito Facchini pt. 5",
      "date": "2014-12-26"
    },
    {
      "sender": "Alessio Macalùso",
      "text": "Valentini 5pt\nPetrini 4 pt perché c'ha messo la sua faccia\nFacchini 3pt sulla fiducia\nNencioni 2pt\nDolfi 1pt",
      "date": "2014-12-26"
    },
    {
      "sender": "Fausto Petrini",
      "text": "Se fosse 50% allora la probabilitá di sceglierla a caso è 25%, ma se allora è 25 essendoci 2 volte è 25x2 =50",
      "date": "2014-12-29"
    },
    {
      "sender": "Fausto Petrini",
      "text": "No no. Ne hanno fatto uno accanto. Poi io vo in bici...\n31/12/14, 15:16 - Cocco: <Media omessi>",
      "date": "2014-12-29"
    },
    {
      "sender": "Giacomo Dolfi",
      "text": "Prima che tu sia preso dall'abbuffata del cenone e dai mille SMS  che manderai..ti bacio ora augurandoti un meraviglioso fine anno e inizio 2015 giec super😘",
      "date": "2014-12-31"
    },
    {
      "sender": "Alessio Macalùso",
      "text": "Come richiesta di capodanno dovete incazzarvi con Camilla perché manda i messaggi col copia incolla\n31/12/14, 19:54 - Alecs: <Media omessi>",
      "date": "2014-12-31"
    },
    {
      "sender": "Alessio Macalùso",
      "text": "Che facciamo gli mandiamo tutti un messaggio uguale?\n31/12/14, 22:30 - Alessio Valentini: <Media omessi>",
      "date": "2014-12-31"
    }
  ]
}