{
  "year": 2026,
  "totalMessages": 528,
  "memberStats": {
    "Alessio Valentini": {
      "messageCount": 111,
      "wordCount": 1163,
      "avgWordsPerMessage": 10.5,
      "longestMessage": "Riassunto della Settimana\nUna settimana memorabile dominata dalla leggendaria storia della scoreggia in cantina di Fausto, che ha trasformato un sopralluogo lavorativo in un capolavoro comico. Giacomo ha poi rilanciato con il racconto del piccolo Valentini che piscia nelle docce, scatenando una catena di ricordi su spogliatoi e getti prodigiosi. Adriano ha cercato di elevare il tono con riflessioni politiche sui saluti fascisti, ma il gruppo ha preferito le storie di pipì. Fausto ha proposto una"
    },
    "Alessio Macalùso": {
      "messageCount": 80,
      "wordCount": 551,
      "avgWordsPerMessage": 6.9,
      "longestMessage": "Buongiorno aperipoker Fausto vi augura una buona settimana\n12/01/26, 07:02 - Alecs: <Media omessi>\n12/01/26, 07:03 - Alecs: <Media omessi>\n12/01/26, 07:41 - Cocco: <Media omessi>\n12/01/26, 08:04 - Giec: <Media omessi>\n12/01/26, 08:04 - Giec: <Media omessi>\n12/01/26, 12:45 - Fede: <Media omessi>\n12/01/26, 12:45 - Fede: <Media omessi>\n12/01/26, 12:45 - Fede: <Media omessi>"
    },
    "Adriano Sergio Lorenzo Facchini": {
      "messageCount": 113,
      "wordCount": 733,
      "avgWordsPerMessage": 6.5,
      "longestMessage": "https://www.linkedin.com/posts/roberto-lambruschi-italy-horse-experience_oriana-fallaci-la-prego-imam-devo-chiederle-activity-7417080003949064192-AQ4K?utm_source=share&utm_medium=member_ios&rcm=ACoAAAxwNaMBUz4Qrd7opk6GeoR1HqzCoJVxASc"
    },
    "Cosimo Nenciòni": {
      "messageCount": 57,
      "wordCount": 425,
      "avgWordsPerMessage": 7.5,
      "longestMessage": "Bravo adri. C'è troppa ipocrisia. Anche io vorrei rinchiudermi in casa a farmi le canne con voialtri tuttavia avrò ospiti il 25 quindi la vedo difficile essere a Siena. Ma se il programma è quello ci posso provare"
    },
    "Fausto Petrini": {
      "messageCount": 78,
      "wordCount": 740,
      "avgWordsPerMessage": 9.5,
      "longestMessage": "https://news.google.com/read/CBMingJBVV95cUxQUi1PNWlZVmtCd3ZNdTNBUE1CX29EMGZmWUwySzFsY18xcWY3a2gwWjEwdGxUenR5b2VRdm9pc3d3Z1pZUTlsR21oREFhNmEzRkswdWpiTW9McEpwcENReVRfMEhRWUlSMHBLNU52TkJBb2JLRjNMMHl6SVVKbWp2dkhTcmI0X0hjU3hPQVI2Sm5YUE5lbU9lM2ttQmtZV3pmWEZjNjJKWl90Y0FVRWVOLXBIeDJ1MHUyM0pxd0tvQVdCTmRSZzRVTFpJRDhZMnVGQ0ItdERMMmV1N0lEckxCZlAtcE1qQkFNRTJYVmdBdWdRQ3dUa00yVzE3dzNOQk44cEhvdDJvUGVRczRHOW9CVkhXeUZMWTd5WnZBTHB30gGjAkFVX3lxTE9ZUi1sSWM3dktXdFo3Y0xBcXNUS2t3OUpkamdZUzVKdVZXNlpvZFJXVWxWR0tlbFBvbmZ"
    },
    "Federico Ceccuzzi": {
      "messageCount": 49,
      "wordCount": 413,
      "avgWordsPerMessage": 8.4,
      "longestMessage": "Comunque Adriano imbattibile\n18/01/26, 19:37 - Alessio Valentini Giusto: <Media omessi>\n18/01/26, 19:40 - Alessio Valentini Giusto: <Media omessi>\n18/01/26, 19:42 - Alessio Valentini Giusto: <Media omessi>\n18/01/26, 19:42 - Alessio Valentini Giusto: <Media omessi>"
    },
    "Giacomo Dolfi": {
      "messageCount": 34,
      "wordCount": 252,
      "avgWordsPerMessage": 7.4,
      "longestMessage": "tipo alla sorella del mio parrucchiere (ilaria alvini, forse la conosci) e quando ci andai gli chiesi: ma ha qualche merito sportivo particolare o ha fatto qualcosa? e lui: no, si è candidata a caso e l'hanno chiamata"
    }
  },
  "monthlyActivity": {
    "2026-01": 354,
    "2026-04": 3,
    "2026-05": 40,
    "2026-06": 26,
    "2026-07": 15,
    "2026-08": 35,
    "2026-09": 14,
    "2026-10": 13,
    "2026-11": 2,
    "2026-12": 20
  },
  "sampleMessages": [
    {
      "sender": "Alessio Valentini",
      "text": "non lo ero e c'hai ragione. Non mi piace il caldo e la spiaggia all' 'italiana' con ombrelloni e sdraio. Ma d'inverno andare ai caraibi a galleggiare sulle spiagge bianche credo abbia più senso.",
      "date": "2026-01-01"
    },
    {
      "sender": "Alessio Valentini",
      "text": "è una laguna, ma c'è un fondo poroso che filtra l'acqua via e ci scioglie così tanti sali minerali che uccide i batteri e le alghe",
      "date": "2026-01-01"
    },
    {
      "sender": "Alessio Valentini",
      "text": "la cosa ganza di questo posto è che c'è acqua dolce, ma senza alghe/batteri. Ganzo.\n01/01/26, 10:20 - Adriano: <Media omessi>",
      "date": "2026-01-01"
    },
    {
      "sender": "Fausto Petrini",
      "text": "Era solo per dire: che progressi fanno i bimbi a questa età, non che fosse un prodigio lui",
      "date": "2026-01-01"
    },
    {
      "sender": "Adriano Sergio Lorenzo Facchini",
      "text": "Io farei un test di paternità.\n03/01/26, 13:48 - Adriano: <Media omessi>\n04/01/26, 12:20 - Alecs: <Media omessi>",
      "date": "2026-01-01"
    },
    {
      "sender": "Adriano Sergio Lorenzo Facchini",
      "text": "Buon anno dalle foreste casentinesi\n01/01/26, 15:16 - Adriano: <Media omessi>\n01/01/26, 15:16 - Fede: <Media omessi>",
      "date": "2026-01-01"
    },
    {
      "sender": "Alessio Macalùso",
      "text": "Pensavo foste su un’isola ma siete sulla terra ferma\n01/01/26, 17:05 - Fausto: <Media omessi>",
      "date": "2026-01-01"
    },
    {
      "sender": "Alessio Macalùso",
      "text": "Buon giorno e buon anno a tutti\n01/01/26, 13:57 - Adriano: <Media omessi>",
      "date": "2026-01-01"
    },
    {
      "sender": "Alessio Valentini",
      "text": "quindi è acqua pulita (non potabile, chiaramente), non sa di lago.",
      "date": "2026-01-01"
    },
    {
      "sender": "Cosimo Nenciòni",
      "text": "Io sono si nuovo ricoverato.  Stamattina mi sono sentito male . ERO in stazione e stavo per salire sul treno per Roma. Per fortuna non l'ho preso sennò sai che casino. Cmq altro calcolo altra colica. Si riparte.",
      "date": "2026-01-13"
    },
    {
      "sender": "Cosimo Nenciòni",
      "text": "Per ora sto a santa Maria Nuova ma vedrai se non ci sono novità tra un paio di gg mi mandano a Torregalli di merda",
      "date": "2026-01-13"
    },
    {
      "sender": "Cosimo Nenciòni",
      "text": "Si insomma. Non è che mi ci sego. Però c'ho mangiato un paio di volte.  Anche un paio di settimane fa. Quello all'uscita?",
      "date": "2026-01-13"
    },
    {
      "sender": "Alessio Macalùso",
      "text": "Vero grazie del consiglio mi farebbe piacere se passaste a fare un saluto allo zio\n13/01/26, 18:00 - Cocco: <Media omessi>",
      "date": "2026-01-13"
    },
    {
      "sender": "Adriano Sergio Lorenzo Facchini",
      "text": "Mangiato tutto al paninaro nel parcheggio del Meyer che è un drago 🐉 e fa cose da ristorante stellato.",
      "date": "2026-01-13"
    },
    {
      "sender": "Alessio Macalùso",
      "text": "Eh sì\n13/01/26, 19:02 - Alessio Valentini Giusto: <Media omessi>\n13/01/26, 19:02 - Alessio Valentini Giusto: <Media omessi>",
      "date": "2026-01-13"
    },
    {
      "sender": "Adriano Sergio Lorenzo Facchini",
      "text": "Lider ascolta un tuo suddito, dai un bonus extra a chi andrà a trovare Cocco in ospedale",
      "date": "2026-01-13"
    },
    {
      "sender": "Adriano Sergio Lorenzo Facchini",
      "text": "Ma poi, ti hanno scannerizzato anche il buco del culo, ma questo calcolo l’avevan preventivato?",
      "date": "2026-01-13"
    },
    {
      "sender": "Cosimo Nenciòni",
      "text": "Io lui non me.lo ricordo.  Il baretto è quello tutto di legno che pare tirolese",
      "date": "2026-01-13"
    },
    {
      "sender": "Federico Ceccuzzi",
      "text": "Comunque direi che ti presenti come Adriano facchini e vai al circolo tennis",
      "date": "2026-01-13"
    },
    {
      "sender": "Cosimo Nenciòni",
      "text": "Beh. Ne ho un po' in corpo quindi ci sta che si muovano",
      "date": "2026-01-13"
    },
    {
      "sender": "Giacomo Dolfi",
      "text": "Proprio ieri il babbo di Lucia ha preparato i fegatelli di cinghiale",
      "date": "2026-01-13"
    },
    {
      "sender": "Adriano Sergio Lorenzo Facchini",
      "text": "Fausto, vai a trovare Cocco e documenta il suo stato di salute.",
      "date": "2026-01-13"
    },
    {
      "sender": "Alessio Macalùso",
      "text": "Io seppie e piselli della mensa buone ma niente di che",
      "date": "2026-01-13"
    },
    {
      "sender": "Adriano Sergio Lorenzo Facchini",
      "text": "É lui?\n13/01/26, 19:50 - Alessio Valentini Giusto: <Media omessi>",
      "date": "2026-01-13"
    },
    {
      "sender": "Cosimo Nenciòni",
      "text": "Ho tanta fame. Ero.pure senza pranzo.  Non è giusto",
      "date": "2026-01-13"
    },
    {
      "sender": "Adriano Sergio Lorenzo Facchini",
      "text": "Stavo per scrivere se era un calcolo calcolato…",
      "date": "2026-01-13"
    },
    {
      "sender": "Adriano Sergio Lorenzo Facchini",
      "text": "A me oggi bene: paccheri carcofini e bottarga.",
      "date": "2026-01-13"
    },
    {
      "sender": "Giacomo Dolfi",
      "text": "Perché Fausto è buono con noi",
      "date": "2026-01-13"
    },
    {
      "sender": "Federico Ceccuzzi",
      "text": "Ottimo per il dopo stravizi natalizi",
      "date": "2026-01-13"
    },
    {
      "sender": "Adriano Sergio Lorenzo Facchini",
      "text": "L’ultimo che ho letto “Un reportage da Gaza” ti apre gli occhi nei confronti della politica suprematista Israeliana.",
      "date": "2026-01-14"
    },
    {
      "sender": "Cosimo Nenciòni",
      "text": "Mi mandano a casa ora. Questi so tutti scemi. A saperllo magnanvo da Mac.",
      "date": "2026-01-14"
    },
    {
      "sender": "Adriano Sergio Lorenzo Facchini",
      "text": "Io oggi a pranzo pollo al curry..\nNon vi nascondo che era buonissimo.",
      "date": "2026-01-14"
    },
    {
      "sender": "Alessio Macalùso",
      "text": "Però potresti sabato o domenica fare un riassunto degli eventi accaduti questa settimana?",
      "date": "2026-01-14"
    },
    {
      "sender": "Cosimo Nenciòni",
      "text": "Notte ok. Nessun dolore. Analisi ok. Vado ora a fare ancora rx",
      "date": "2026-01-14"
    },
    {
      "sender": "Federico Ceccuzzi",
      "text": "Ma non ha capito ma quanta gente c’è all’ospedale ?",
      "date": "2026-01-14"
    },
    {
      "sender": "Fausto Petrini",
      "text": "Ven sera io avrei libera uscita, qualcuno vuole fare qualcosa?",
      "date": "2026-01-14"
    },
    {
      "sender": "Alessio Macalùso",
      "text": "Io sarei a Figline con amici anche lì potreste venire",
      "date": "2026-01-14"
    },
    {
      "sender": "Alessio Macalùso",
      "text": "Mandate foto cena\n14/01/26, 19:07 - Cocco: <Media omessi>",
      "date": "2026-01-14"
    },
    {
      "sender": "Giacomo Dolfi",
      "text": "Daje zi!\n14/01/26, 18:46 - Alecs: <Media omessi>",
      "date": "2026-01-14"
    },
    {
      "sender": "Alessio Macalùso",
      "text": "Sono disidratato ho avuto diarrea e vomito",
      "date": "2026-01-14"
    },
    {
      "sender": "Alessio Macalùso",
      "text": "Malasanità\n14/01/26, 22:07 - Adriano: <Media omessi>",
      "date": "2026-01-14"
    },
    {
      "sender": "Alessio Macalùso",
      "text": "Bello?\n14/01/26, 22:08 - Adriano: <Media omessi>",
      "date": "2026-01-14"
    },
    {
      "sender": "Alessio Macalùso",
      "text": "Vero ma non peggio dei nazisti",
      "date": "2026-01-14"
    },
    {
      "sender": "Adriano Sergio Lorenzo Facchini",
      "text": "In aiuto a quando spieghi il turbamento che certe zoccole provocano intenzionalmente negli uomini.",
      "date": "2026-01-15"
    },
    {
      "sender": "Adriano Sergio Lorenzo Facchini",
      "text": "Aveva anche un vibratore a distanza che si azionava con la voce di lui.",
      "date": "2026-01-15"
    },
    {
      "sender": "Alessio Macalùso",
      "text": "Vai matto per il sushi e per il fumo e non vai…",
      "date": "2026-01-15"
    },
    {
      "sender": "Alessio Valentini",
      "text": "spero che sotto avesse la minigonna con calze a rete",
      "date": "2026-01-15"
    },
    {
      "sender": "Fausto Petrini",
      "text": "No grazie adri ti ringrazio, non la faccio lunga",
      "date": "2026-01-15"
    },
    {
      "sender": "Adriano Sergio Lorenzo Facchini",
      "text": "Dai vabbè, mi spiace. Se ci ripensi però..",
      "date": "2026-01-15"
    },
    {
      "sender": "Giacomo Dolfi",
      "text": "Faustoda anche io sono a cena fuori",
      "date": "2026-01-15"
    },
    {
      "sender": "Fausto Petrini",
      "text": "Ora invece sono in un posto a sentire gente che suona, l'ultimo a firenze che il fine settimana fa concertini live. Mi ha fatto un pò tristezza che i signature coctails hanno i nomi di tutti i vecchi locali che a firenze facevano musica. Tutti chiusi ormai. Ora qui a sentire questo duo siamo in 8, f",
      "date": "2026-01-16"
    },
    {
      "sender": "Giacomo Dolfi",
      "text": "tipo alla sorella del mio parrucchiere (ilaria alvini, forse la conosci) e quando ci andai gli chiesi: ma ha qualche merito sportivo particolare o ha fatto qualcosa? e lui: no, si è candidata a caso e l'hanno chiamata",
      "date": "2026-01-16"
    },
    {
      "sender": "Fausto Petrini",
      "text": "Ragazzi non vedo l'ora di tornare un giorno ad essere leader, avrei proprio voglia di portarvi a fare una cena in posti davvero ma davvero fighi",
      "date": "2026-01-16"
    },
    {
      "sender": "Fausto Petrini",
      "text": "Però 4 bariste fiche anche qui\n16/01/26, 22:22 - Fausto: <Media omessi>\n16/01/26, 22:35 - Fausto: <Media omessi>",
      "date": "2026-01-16"
    },
    {
      "sender": "Fausto Petrini",
      "text": "Sono in giro pee san frediano, e, ragazzi, qui c'è DAVVERO la vera fica",
      "date": "2026-01-16"
    },
    {
      "sender": "Giacomo Dolfi",
      "text": "succede che hanno fatto portare la fiamma delle olimpiadi a cazzo di cane",
      "date": "2026-01-16"
    },
    {
      "sender": "Fausto Petrini",
      "text": "Hanno inoziato presto, ma mi sa che dopo c'è un altro gruppi",
      "date": "2026-01-16"
    },
    {
      "sender": "Giacomo Dolfi",
      "text": "e ora si trovano in vendita a milioni di miliardi",
      "date": "2026-01-16"
    },
    {
      "sender": "Adriano Sergio Lorenzo Facchini",
      "text": "Tranne secondo me l’uomo gatto che se lo merita.",
      "date": "2026-01-16"
    },
    {
      "sender": "Fausto Petrini",
      "text": "Una vera seratona, no a casa a mezzanotte",
      "date": "2026-01-16"
    },
    {
      "sender": "Alessio Macalùso",
      "text": "Peccato per il sushi e per il fumo",
      "date": "2026-01-16"
    },
    {
      "sender": "Fausto Petrini",
      "text": "Cencios: vodka sanbuco lime e soda al pompelmo",
      "date": "2026-01-16"
    },
    {
      "sender": "Adriano Sergio Lorenzo Facchini",
      "text": "Ti sei un po’ stanco, vai a letto.",
      "date": "2026-01-16"
    },
    {
      "sender": "Giacomo Dolfi",
      "text": "le hanno regalato anche la tuta",
      "date": "2026-01-16"
    },
    {
      "sender": "Cosimo Nenciòni",
      "text": "Bravo adri. C'è troppa ipocrisia. Anche io vorrei rinchiudermi in casa a farmi le canne con voialtri tuttavia avrò ospiti il 25 quindi la vedo difficile essere a Siena. Ma se il programma è quello ci posso provare",
      "date": "2026-01-17"
    },
    {
      "sender": "Fausto Petrini",
      "text": "Cmq per chiarezza: io ho gran voglia di vedersi e anche farsi le canne se capita, certo. Ma poi voglio cmq fare una seratona a far tardi, possibilmente a firenze, a fare struscio",
      "date": "2026-01-17"
    },
    {
      "sender": "Cosimo Nenciòni",
      "text": "Poi certo.. se si tratta di uscire a cena, andare a bere fingendo di socializzare con altri individui allora mi sa che non vengo\n17/01/26, 20:42 - Adriano: <Media omessi>",
      "date": "2026-01-17"
    },
    {
      "sender": "Alessio Valentini",
      "text": "nel frattempo, io, dopo essere andato a letto a mezzanotte, mi sono alzato alle 10, colazione, tornato a letto e adesso alle 3 del pomeriggio faccio pranzo.",
      "date": "2026-01-17"
    },
    {
      "sender": "Federico Ceccuzzi",
      "text": "Peccato ma ho una gara di Livia a Sesto F. perché con questo Fausto on fire, si prospetta  una serata da annali (o da anali)",
      "date": "2026-01-17"
    },
    {
      "sender": "Fausto Petrini",
      "text": "È una persona gentile che a mio parere, e non credo sia cambiato, è veramente come appare, non fintamente...",
      "date": "2026-01-17"
    },
    {
      "sender": "Federico Ceccuzzi",
      "text": "Ps anche io non vedo l’ora di fare il Lider, il gruppo ha bisogno di un periodo “dirigista”",
      "date": "2026-01-17"
    },
    {
      "sender": "Federico Ceccuzzi",
      "text": "Domani avrò una gara podistica con lui e poi ci vado a pranzo",
      "date": "2026-01-17"
    },
    {
      "sender": "Federico Ceccuzzi",
      "text": "Comunque Fausto “ abbisogni” (e quindi dovrebbe essere organizzata )di serata bollore",
      "date": "2026-01-17"
    },
    {
      "sender": "Cosimo Nenciòni",
      "text": "Io penso di avergli rivolto parola 5 volte in 5 anni",
      "date": "2026-01-17"
    },
    {
      "sender": "Federico Ceccuzzi",
      "text": "Su sua iniziativa peraltro , io ero bello in panciolle",
      "date": "2026-01-17"
    },
    {
      "sender": "Alessio Macalùso",
      "text": "Tutte cose che andranno a finire nel riassunto della settimana",
      "date": "2026-01-17"
    },
    {
      "sender": "Alessio Macalùso",
      "text": "Da qui al 25 c’ha tempo di smaltire la smania",
      "date": "2026-01-17"
    },
    {
      "sender": "Federico Ceccuzzi",
      "text": "Domanda , ma il fiorini era in classe vostra?",
      "date": "2026-01-17"
    },
    {
      "sender": "Adriano Sergio Lorenzo Facchini",
      "text": "Destinato già in adolescenza ad una vita impiegatizia però.",
      "date": "2026-01-17"
    },
    {
      "sender": "Adriano Sergio Lorenzo Facchini",
      "text": "Comunque se riesco vengo anch’io a fammi du’ canne.",
      "date": "2026-01-17"
    },
    {
      "sender": "Cosimo Nenciòni",
      "text": "https://x.com/i/status/2012344120509874470\n18/01/26, 03:55 - Alessio Valentini Giusto: <Media omessi>",
      "date": "2026-01-17"
    },
    {
      "sender": "Fausto Petrini",
      "text": "Sarò di nuovo a siena domenica 25 sera",
      "date": "2026-01-17"
    },
    {
      "sender": "Cosimo Nenciòni",
      "text": "Anali magari.. ma non ci scommetterei un penny",
      "date": "2026-01-17"
    },
    {
      "sender": "Cosimo Nenciòni",
      "text": "Oppure, piu facile, non uscite da casa tua",
      "date": "2026-01-17"
    },
    {
      "sender": "Federico Ceccuzzi",
      "text": "Bene ora vado a fare una corsetta",
      "date": "2026-01-17"
    },
    {
      "sender": "Cosimo Nenciòni",
      "text": "In termini di rilevanza nella mia vita",
      "date": "2026-01-17"
    },
    {
      "sender": "Alessio Valentini",
      "text": "ad occhio eh\n18/01/26, 17:33 - Alessio Valentini Giusto: c'e' qualcuno che non ha cambiato telefono da anni?\n18/01/26, 17:41 - Alessio Valentini Giusto: <Media omessi>\n18/01/26, 17:41 - Alessio Valentini Giusto: <Media omessi>\n18/01/26, 17:41 - Alessio Valentini Giusto: <Media omessi>\n18/01/26, 17:4",
      "date": "2026-01-18"
    },
    {
      "sender": "Alessio Valentini",
      "text": "I temi delle settimane sono fantastici:\n- Settimana 14: \"Luna chiede 'Come nascono i bambini?' - Alessio risponde 'la cicogna ti infila IL BECCO NELLA FICA'\"\n- Settimana 29: \"COLICA RENALE EPICA di Cosimo (350 messaggi!) e stent da 26 cm 'dal cazzo al rene'\"\n- Settimana 33: \"Fausto svenuto in tavern",
      "date": "2026-01-18"
    },
    {
      "sender": "Federico Ceccuzzi",
      "text": "Comunque Adriano imbattibile\n18/01/26, 19:37 - Alessio Valentini Giusto: <Media omessi>\n18/01/26, 19:40 - Alessio Valentini Giusto: <Media omessi>\n18/01/26, 19:42 - Alessio Valentini Giusto: <Media omessi>\n18/01/26, 19:42 - Alessio Valentini Giusto: <Media omessi>",
      "date": "2026-01-18"
    },
    {
      "sender": "Alessio Valentini",
      "text": "già fatto\n19/01/26, 03:03 - Alessio Valentini Giusto: <Media omessi>\n19/01/26, 03:06 - Alessio Valentini Giusto: <Media omessi>\n19/01/26, 03:07 - Alessio Valentini Giusto: <Media omessi>\n19/01/26, 03:15 - Alessio Valentini Giusto: <Media omessi>",
      "date": "2026-01-18"
    },
    {
      "sender": "Fausto Petrini",
      "text": "Ora dovresti creare un agent che ogni settimana ad orario fisso ci manda riassunto della settimana, e una volta all'anno ci manda il riassuntone annuale",
      "date": "2026-01-18"
    },
    {
      "sender": "Cosimo Nenciòni",
      "text": "Col telefono niente da fare. Io be ho cambiati troppi. Non lu honorem 2020. Altru modi? Magari ci sono dei backup somewhere",
      "date": "2026-01-18"
    },
    {
      "sender": "Fausto Petrini",
      "text": "\"Io tedoforo, ma lo sport è la f... Altro che neve, amo l'aperitivo\" è soltanto una delle affermazioni contestate all'attore.",
      "date": "2026-01-18"
    },
    {
      "sender": "Federico Ceccuzzi",
      "text": "Bello!!!👍🏻 mi garba\n18/01/26, 18:53 - Alessio Valentini Giusto: <Media omessi>\n18/01/26, 18:54 - Alessio Valentini Giusto: <Media omessi>",
      "date": "2026-01-18"
    },
    {
      "sender": "Alessio Valentini",
      "text": "mi sono sentito Fausto, ma la fica di San Frediano credo fosse PARECCHIO meglio",
      "date": "2026-01-18"
    },
    {
      "sender": "Alessio Valentini",
      "text": "ho gia' controllato. Ogni volt ahce cambi telefono ti butta via la roba vecchia",
      "date": "2026-01-18"
    },
    {
      "sender": "Alessio Valentini",
      "text": "sta facendo le pagelle del 2025\n18/01/26, 18:31 - Alessio Valentini Giusto: <Media omessi>",
      "date": "2026-01-18"
    },
    {
      "sender": "Alessio Valentini",
      "text": "io sto ridendo da 2 ore\n18/01/26, 19:47 - Alessio Valentini Giusto: <Media omessi>",
      "date": "2026-01-18"
    },
    {
      "sender": "Alessio Valentini",
      "text": "vi dico quando ha finito\n18/01/26, 18:39 - Alessio Valentini Giusto: <Media omessi>",
      "date": "2026-01-18"
    },
    {
      "sender": "Giacomo Dolfi",
      "text": "Era una cavolata perché la mia definizione era di curioso di gossip politico",
      "date": "2026-01-18"
    },
    {
      "sender": "Alessio Valentini",
      "text": "serve un cellulare vecchio che ha whatsapp da \"che abbiamo aperto aperipoker\"",
      "date": "2026-01-18"
    },
    {
      "sender": "Alessio Valentini",
      "text": "ma mi sono emozionato e ho sharato il sito lo stesso",
      "date": "2026-01-18"
    },
    {
      "sender": "Cosimo Nenciòni",
      "text": "Emorroide ciliegia\n18/01/26, 20:34 - Alessio Valentini Giusto: <Media omessi>",
      "date": "2026-01-18"
    },
    {
      "sender": "Giacomo Dolfi",
      "text": "Meritato 😂\n18/01/26, 21:13 - ‎Fede ha fissato un messaggio.",
      "date": "2026-01-18"
    },
    {
      "sender": "Alessio Macalùso",
      "text": "E bravo Adriano che è il preferito della AI",
      "date": "2026-01-18"
    },
    {
      "sender": "Fausto Petrini",
      "text": "Ahahahaahahahah\n18/01/26, 18:40 - Alessio Valentini Giusto: <Media omessi>",
      "date": "2026-01-18"
    },
    {
      "sender": "Alessio Macalùso",
      "text": "Ahahahah\n18/01/26, 18:56 - Alessio Valentini Giusto: <Media omessi>",
      "date": "2026-01-18"
    },
    {
      "sender": "Alessio Macalùso",
      "text": "Ahahahaha\n18/01/26, 20:31 - Alessio Valentini Giusto: <Media omessi>",
      "date": "2026-01-18"
    },
    {
      "sender": "Cosimo Nenciòni",
      "text": "Come faccio a saperlo? Dove devo guardare?",
      "date": "2026-01-18"
    },
    {
      "sender": "Alessio Valentini",
      "text": "Riassunto della Settimana\nUna settimana memorabile dominata dalla leggendaria storia della scoreggia in cantina di Fausto, che ha trasformato un sopralluogo lavorativo in un capolavoro comico. Giacomo ha poi rilanciato con il racconto del piccolo Valentini che piscia nelle docce, scatenando una cate",
      "date": "2026-01-19"
    },
    {
      "sender": "Alessio Valentini",
      "text": "POI LA NOTIZIA: Cocco condivide foto di bimbo: 'Questo ha 1 settimana. Nome?'. Alessio V.: 'Lucia. Nata Lunedi''. E' NATA LA FIGLIA DI ALESSIO V.! Cocco: 'Siete certamente molto belli'. <Questo messaggio è stato modificato>\n19/01/26, 18:08 - Alessio Valentini Giusto: <Media omessi>",
      "date": "2026-01-19"
    },
    {
      "sender": "Alessio Valentini",
      "text": "fa delle robe allucinanti perche' gli ho detto di fare 4 anni in uno. Quindi ora crede che io abbia una figlia\n19/01/26, 18:12 - Alessio Valentini Giusto: <Media omessi>\n19/01/26, 18:13 - Alessio Valentini Giusto: <Media omessi>",
      "date": "2026-01-19"
    },
    {
      "sender": "Alessio Valentini",
      "text": "cmq prima fai \"esporta senza media\" -> file piccolo che dovrebbe essere facile da generare/gestire. Poi quando hai mandato quello puoi fare \"esporta CON media\" -> questo file e' gigantesto e cmq sarebbe interessante metterlo da qualche parte",
      "date": "2026-01-19"
    },
    {
      "sender": "Alessio Macalùso",
      "text": "Comunque questa settimana vorrei che fosse anche @⁨Adriano⁩, altro grande domatore di AI, a farci vedere cosa chiede e cosa ChatGPT risponde <Questo messaggio è stato modificato>",
      "date": "2026-01-19"
    },
    {
      "sender": "Alessio Valentini",
      "text": "Secondo lui la riflessione toccante sulla morte di Vialli e' la cosa piu' bella che Adriano ha fatto nel 2023. E io mi ci scompiscioo",
      "date": "2026-01-19"
    },
    {
      "sender": "Fausto Petrini",
      "text": "Ma in che formato ti si possono dare? Cioè: io ho i cellulari vecchi, ma come faccio a recuperare i backup?",
      "date": "2026-01-19"
    },
    {
      "sender": "Alessio Valentini",
      "text": "Cocco, proclamato \"Difensore del ragno\" per la settimana del 7 dicembre 2025, come stai? <Questo messaggio è stato modificato>",
      "date": "2026-01-19"
    },
    {
      "sender": "Alessio Macalùso",
      "text": "Un leader ci portò a cena a Empoli in un posto dove c’era un pianista che suonava al ristorante",
      "date": "2026-01-19"
    },
    {
      "sender": "Federico Ceccuzzi",
      "text": "Tipo : @⁨Alessio Valentini Giusto⁩ mi tiri fuori le tue foto sopra il Ping pong dell’appartamento di Bruxelles?",
      "date": "2026-01-19"
    },
    {
      "sender": "Fausto Petrini",
      "text": "Ho anche la.schedina sd che usavo già su quello prima, ma credo che nkn vada tanto 8ndietro",
      "date": "2026-01-19"
    },
    {
      "sender": "Alessio Valentini",
      "text": "io spendo 200 euro al mese di AI, e ho finito tutti i Token solo stamattina, ahhahaha",
      "date": "2026-01-19"
    },
    {
      "sender": "Alessio Valentini",
      "text": "io non ho la chat prima del 2020 purtroppo, e' quello che sto provando a chiedervi",
      "date": "2026-01-19"
    },
    {
      "sender": "Alessio Valentini",
      "text": "io ho preso l'unico 10 (per ora)\n19/01/26, 18:27 - Alessio Valentini Giusto: <Media omessi>",
      "date": "2026-01-19"
    },
    {
      "sender": "Alessio Macalùso",
      "text": "Ma davvero sono successero tutte queste cose?\n19/01/26, 18:31 - Alessio Valentini Giusto: <Media omessi>",
      "date": "2026-01-19"
    },
    {
      "sender": "Alessio Valentini",
      "text": "se avete vecchi cellulari funzionanti con whatsapp ancora installato\n19/01/26, 18:40 - Alecs: <Media omessi>",
      "date": "2026-01-19"
    },
    {
      "sender": "Alessio Valentini",
      "text": "INCREDIBBBBBILE\n19/01/26, 18:42 - Alecs: <Media omessi>\n19/01/26, 18:43 - Alecs: <Media omessi>",
      "date": "2026-01-19"
    },
    {
      "sender": "Alessio Valentini",
      "text": "io non so che dire, ma mi sto spisciando. Anche quando allucina.",
      "date": "2026-01-19"
    },
    {
      "sender": "Alessio Valentini",
      "text": "perche' in pandemia ho cambiato telefono e whatsapp sovrascrive i backup",
      "date": "2026-01-19"
    },
    {
      "sender": "Alessio Valentini",
      "text": "Cosimo 8: Indovina che Fausto sta cagando alle 3 di notte",
      "date": "2026-01-19"
    },
    {
      "sender": "Federico Ceccuzzi",
      "text": "Secondo me spara a caso per aver un buon punteggio dall’Ai",
      "date": "2026-01-19"
    },
    {
      "sender": "Federico Ceccuzzi",
      "text": "Scusate me lo contestualizzate ?\n19/01/26, 18:44 - Alecs: <Media omessi>",
      "date": "2026-01-19"
    },
    {
      "sender": "Adriano Sergio Lorenzo Facchini",
      "text": "E quindi? Con la cronologia storica?  Cosa é venuto fuori?",
      "date": "2026-01-19"
    },
    {
      "sender": "Alessio Macalùso",
      "text": "Felicità è ciò che sta fra una colica e l’altra",
      "date": "2026-01-19"
    },
    {
      "sender": "Giacomo Dolfi",
      "text": "Appena scoperto che le ho tutte dal 2013 😂😂",
      "date": "2026-01-19"
    },
    {
      "sender": "Giacomo Dolfi",
      "text": "Ora il cellulare al 19% e sono senza wifi",
      "date": "2026-01-19"
    },
    {
      "sender": "Cosimo Nenciòni",
      "text": "Sto bene. Vivo nell attesa della prossima colica",
      "date": "2026-01-19"
    },
    {
      "sender": "Giacomo Dolfi",
      "text": "La cena a Empoli con il pianista",
      "date": "2026-01-19"
    },
    {
      "sender": "Cosimo Nenciòni",
      "text": "@⁨Alessio Valentini Giusto⁩ sei poi tornato?",
      "date": "2026-04-01"
    },
    {
      "sender": "Fausto Petrini",
      "text": "Solo per curiosità e senza impegno per ora, ma domani sera ci sarebbe nessuno a Siena?",
      "date": "2026-05-01"
    },
    {
      "sender": "Fausto Petrini",
      "text": "Il 7 mattina devo essere a siena e potrei anche tutto sommato venire già domani sera",
      "date": "2026-05-01"
    },
    {
      "sender": "Adriano Sergio Lorenzo Facchini",
      "text": "Soddisfazione massima per aver aggiustato l’autoclave con chat gpt. Totale spesa 10 euro.",
      "date": "2026-05-01"
    },
    {
      "sender": "Federico Ceccuzzi",
      "text": "Dopo un cunicolo in salita da fare piegati di 20 mt",
      "date": "2026-05-01"
    },
    {
      "sender": "Federico Ceccuzzi",
      "text": "Dono di conoscenza che trasmetto è: non entrate mai  dentro.",
      "date": "2026-05-01"
    },
    {
      "sender": "Cosimo Nenciòni",
      "text": "Ti casca l uccello\n05/01/26, 15:40 - Fede: <Media omessi>",
      "date": "2026-05-01"
    },
    {
      "sender": "Fausto Petrini",
      "text": "Sei all'interno forse dell'unica rimasta delle 7 meraviglie del mondo",
      "date": "2026-05-01"
    },
    {
      "sender": "Federico Ceccuzzi",
      "text": "Ecco il perché\n05/01/26, 15:41 - Fede: <Media omessi>",
      "date": "2026-05-01"
    },
    {
      "sender": "Cosimo Nenciòni",
      "text": "Passano gli anni ma ha sempre il suo perché",
      "date": "2026-05-01"
    },
    {
      "sender": "Giacomo Dolfi",
      "text": "Siamo un po' accampati ma ci si può fare",
      "date": "2026-05-01"
    },
    {
      "sender": "Giacomo Dolfi",
      "text": "Per me oggi prima notte nella casa sistemata",
      "date": "2026-05-01"
    },
    {
      "sender": "Federico Ceccuzzi",
      "text": "Ma alla fine te sei bravo",
      "date": "2026-05-01"
    },
    {
      "sender": "Alessio Valentini",
      "text": "ho un buon ricordo di questo libro, ma non so se ce la farei a rileggerlo.",
      "date": "2026-06-01"
    },
    {
      "sender": "Adriano Sergio Lorenzo Facchini",
      "text": "Ma a Firenze quanto sta nevicando?\n06/01/26, 13:09 - Adriano: <Media omessi>",
      "date": "2026-06-01"
    },
    {
      "sender": "Fausto Petrini",
      "text": "\n06/01/26, 16:02 - Fausto: <Media omessi>\n06/01/26, 16:02 - Fausto: <Media omessi>",
      "date": "2026-06-01"
    },
    {
      "sender": "Fausto Petrini",
      "text": "Questo è il mi fratello sulla fi-si un ora fa...",
      "date": "2026-06-01"
    },
    {
      "sender": "Alessio Macalùso",
      "text": "Un gin tonic ci può stare",
      "date": "2026-06-01"
    },
    {
      "sender": "Fausto Petrini",
      "text": "Io invece grandw acquisto per la montagna che ora userò per l'inverrno, 100 euri a decatlon e via",
      "date": "2026-07-01"
    },
    {
      "sender": "Alessio Valentini",
      "text": "io sono andato due volte in barca col vento a 30 gradi",
      "date": "2026-07-01"
    },
    {
      "sender": "Adriano Sergio Lorenzo Facchini",
      "text": "Per me poi che non ho giacchetto invernali è un inferno",
      "date": "2026-07-01"
    },
    {
      "sender": "Alessio Valentini",
      "text": "bicarbonato TOP con le patate\n08/01/26, 03:02 - Alecs: <Media omessi>",
      "date": "2026-07-01"
    },
    {
      "sender": "Adriano Sergio Lorenzo Facchini",
      "text": "Ma che cazzo di freddo fa a Siena???",
      "date": "2026-07-01"
    },
    {
      "sender": "Fausto Petrini",
      "text": "In tangenziale tra acquacalda e Siena nord si circola in una corsia sola per via della neve ghiacciata\n08/01/26, 08:41 - Fausto: <Media omessi>\n08/01/26, 08:41 - Fausto: <Media omessi>\n08/01/26, 08:41 - Fausto: <Media omessi>",
      "date": "2026-08-01"
    },
    {
      "sender": "Fausto Petrini",
      "text": "Nevicata (imprevista) a Siena: il Comune annuncia chiusura scuole per oggi, giovedì 8 gennaio - Il Gazzettino del Chianti e delle colline fiorentine https://www.gazzettinodelchianti.it/firenze-siena-toscana/nevicata-imprevista-a-siena-il-comune-annuncia-chiusura-scuole-per-oggi-giovedi-8-gennaio/\n08",
      "date": "2026-08-01"
    },
    {
      "sender": "Fausto Petrini",
      "text": "Ma poi vorrei sapere su che basi hanno ricostruito il volto di mosè, con che grado di approssimazione...",
      "date": "2026-08-01"
    },
    {
      "sender": "Adriano Sergio Lorenzo Facchini",
      "text": "Ma a Siena ci vivo, é la siena Firenze che mi preoccupa.\n08/01/26, 08:43 - Fede: <Media omessi>",
      "date": "2026-08-01"
    },
    {
      "sender": "Alessio Macalùso",
      "text": "C’ho messo 30min per fare due ponti - casa\n08/01/26, 08:23 - Fede: <Media omessi>",
      "date": "2026-08-01"
    },
    {
      "sender": "Adriano Sergio Lorenzo Facchini",
      "text": "É un millimetro di neve te lo posso assicurare\n08/01/26, 08:42 - Adriano: <Media omessi>",
      "date": "2026-08-01"
    },
    {
      "sender": "Adriano Sergio Lorenzo Facchini",
      "text": "Di sarabanda\n09/01/26, 08:37 - Fausto: <Media omessi>\n09/01/26, 08:37 - Fausto: <Media omessi>",
      "date": "2026-08-01"
    },
    {
      "sender": "Giacomo Dolfi",
      "text": "Infatti è perfetta per cascarci quando porto Pietro e Gio a scuola 😂",
      "date": "2026-08-01"
    },
    {
      "sender": "Alessio Macalùso",
      "text": "\n08/01/26, 07:52 - Alecs: <Media omessi>\n08/01/26, 07:52 - Alecs: <Media omessi>",
      "date": "2026-08-01"
    },
    {
      "sender": "Fausto Petrini",
      "text": "L'ho scritto per te per aggiornarti, a me mi cambia poco",
      "date": "2026-08-01"
    },
    {
      "sender": "Alessio Macalùso",
      "text": "Infatti ha anche la barba e i baffi appena fatti",
      "date": "2026-08-01"
    },
    {
      "sender": "Adriano Sergio Lorenzo Facchini",
      "text": "Sì ma un centimetro di neve dura come il ghiaccio",
      "date": "2026-08-01"
    },
    {
      "sender": "Federico Ceccuzzi",
      "text": "Spero sia stata presa durante la tua corsa mattutina",
      "date": "2026-08-01"
    },
    {
      "sender": "Cosimo Nenciòni",
      "text": "Freddo polare\n08/01/26, 08:00 - Cocco: <Media omessi>",
      "date": "2026-08-01"
    },
    {
      "sender": "Cosimo Nenciòni",
      "text": "Ma a Siena ha nevicato di nuovo?",
      "date": "2026-08-01"
    },
    {
      "sender": "Alessio Macalùso",
      "text": "Poi la gente a Siena si ferma",
      "date": "2026-08-01"
    },
    {
      "sender": "Federico Ceccuzzi",
      "text": "🤣\n08/01/26, 08:44 - Adriano: <Media omessi>",
      "date": "2026-08-01"
    },
    {
      "sender": "Federico Ceccuzzi",
      "text": "Ahahah ero partito dal secondo ed ho pensato che tu avessi fatto nottata a vedere le repliche delle finali Milano Pesaro",
      "date": "2026-09-01"
    },
    {
      "sender": "Adriano Sergio Lorenzo Facchini",
      "text": "Si, è evidente.\n09/01/26, 17:40 - Adriano: <Media omessi>",
      "date": "2026-09-01"
    },
    {
      "sender": "Adriano Sergio Lorenzo Facchini",
      "text": "Comunque sono a vedere il concerto della PFM al teatro tenda Carrara, un tempo noto come Obi Hall, prima ancora Tuscany Hall, e prima ancora Sashol, e prima ancora non mi ricordo se addirittura teatro De André.",
      "date": "2026-10-01"
    },
    {
      "sender": "Giacomo Dolfi",
      "text": "Io non ci sono\n10/01/26, 19:07 - Fede: <Media omessi>",
      "date": "2026-10-01"
    },
    {
      "sender": "Fausto Petrini",
      "text": "Lunedì sera? C'è Qualcuno a Siena? Vorreste far qualcosa?",
      "date": "2026-10-01"
    },
    {
      "sender": "Adriano Sergio Lorenzo Facchini",
      "text": "Io ci sono, si potrebbe andare alla Tea room",
      "date": "2026-10-01"
    },
    {
      "sender": "Federico Ceccuzzi",
      "text": "Sto sgrassando dopo gli eccessi natalizi",
      "date": "2026-10-01"
    },
    {
      "sender": "Federico Ceccuzzi",
      "text": "Ma andrei\n11/01/26, 12:20 - Fede: <Media omessi>\n11/01/26, 12:38 - Fede: <Media omessi>\n12/01/26, 07:00 - Alecs: <Media omessi>",
      "date": "2026-11-01"
    },
    {
      "sender": "Alessio Macalùso",
      "text": "Hai il biglietto? Mi stanno un po’ sui coglioni ma la zanzara la ascolto da sempre…",
      "date": "2026-11-01"
    },
    {
      "sender": "Alessio Macalùso",
      "text": "Buongiorno aperipoker Fausto vi augura una buona settimana\n12/01/26, 07:02 - Alecs: <Media omessi>\n12/01/26, 07:03 - Alecs: <Media omessi>\n12/01/26, 07:41 - Cocco: <Media omessi>\n12/01/26, 08:04 - Giec: <Media omessi>\n12/01/26, 08:04 - Giec: <Media omessi>\n12/01/26, 12:45 - Fede: <Media omessi>\n12/0",
      "date": "2026-12-01"
    },
    {
      "sender": "Adriano Sergio Lorenzo Facchini",
      "text": "Pagate dai contribuenti. Ma in realtà le giornate di 104 sono giornate assistenziali, e possono essere utilizzate anche solo per fare compagnia al genitore.",
      "date": "2026-12-01"
    },
    {
      "sender": "Fausto Petrini",
      "text": "Dove posso andare domani a pranzo con mi fratre zona mazzini/stazione una cosa sem0lice al volo in posto tranquillo?",
      "date": "2026-12-01"
    },
    {
      "sender": "Adriano Sergio Lorenzo Facchini",
      "text": "Usate per cose serie servono.\nIl mio collega le inserisce anche ad agosto e le sfrutta come ferie.",
      "date": "2026-12-01"
    },
    {
      "sender": "Fausto Petrini",
      "text": "Le sfutto per andare a parlare in asl domani del mi babbo, mi sembra sufficiente",
      "date": "2026-12-01"
    },
    {
      "sender": "Fausto Petrini",
      "text": "Non schifoso, ma che si possa sedersi un ora mangiare e parlare?",
      "date": "2026-12-01"
    },
    {
      "sender": "Alessio Macalùso",
      "text": "Ovviamente prenderò i soldi dalla cassa aperipoker per pagare i danni",
      "date": "2026-12-01"
    },
    {
      "sender": "Adriano Sergio Lorenzo Facchini",
      "text": "Non c’è verso di sfruttare queste 104 a dovere.",
      "date": "2026-12-01"
    },
    {
      "sender": "Fausto Petrini",
      "text": "Per stase mi tocca passare, c'ho giulio malato",
      "date": "2026-12-01"
    },
    {
      "sender": "Federico Ceccuzzi",
      "text": "Con 3000 euro di agenzia privata è fatta",
      "date": "2026-12-01"
    },
    {
      "sender": "Alessio Macalùso",
      "text": "Paraurti andato\n12/01/26, 23:49 - Alecs: <Media omessi>",
      "date": "2026-12-01"
    },
    {
      "sender": "Federico Ceccuzzi",
      "text": "Esattamente, un bel rapportino con relative foto",
      "date": "2026-12-01"
    },
    {
      "sender": "Alessio Macalùso",
      "text": "Oggi ho preso un branco di cinghialini",
      "date": "2026-12-01"
    },
    {
      "sender": "Federico Ceccuzzi",
      "text": "Basterebbe fargli il culo e licenziarlo",
      "date": "2026-12-01"
    }
  ]
}